No,Date,Title,Summary,Content,Link
14,04-07-2022 - 11:00 AM,Một số quy định về kinh doanh trò chơi điện tử có thưởng dành cho người nước ngoài,Bộ Tài chính vừa ban hành Thông tư số 39/2022/TT-BTC hướng dẫn một số điều của Nghị định số 121/2021/NĐ-CP của Chính phủ về kinh doanh trò chơi điện tử có thưởng dành cho người nước ngoài.,"TIN MỚI
Thông tư quy định, phí thẩm định cấp, gia hạn Giấy chứng nhận đủ điều kiện kinh doanh của doanh nghiệp là 150 triệu đồng. Phí thẩm định cấp lại, điều chỉnh Giấy chứng nhận đủ điều kiện kinh doanh của doanh nghiệp là 5 triệu đồng.
Theo Thông tư, sau khi thẩm định doanh nghiệp đủ điều kiện được cấp, cấp lại, điều chỉnh và gia hạn giấy chứng nhận đủ điều kiện kinh doanh, Bộ Tài chính thông báo cho doanh nghiệp nộp phí thẩm định theo quy định của pháp luật.
Sau khi nhận được thông báo của Bộ Tài chính, doanh nghiệp có trách nhiệm nộp phí vào ngân sách nhà nước theo quy định. Doanh nghiệp chỉ được cấp, cấp lại, điều chỉnh và gia hạn giấy chứng nhận đủ điều kiện kinh doanh sau khi đã nộp phí vào ngân sách nhà nước.
Ngoài ra, theo quy định tại thông tư, doanh nghiệp được quyền tạm ngừng sử dụng đồng tiền quy ước theo nhu cầu quản lý. Tối thiểu 5 ngày làm việc trước thời điểm tạm ngừng sử dụng đồng tiền quy ước, doanh nghiệp phải thông báo bằng văn bản với Sở Tài chính, cơ quan thuế trực tiếp quản lý tại địa phương để theo dõi, quản lý. Trường hợp có thay đổi về thời điểm tiếp tục sử dụng đồng tiền quy ước trở lại, doanh nghiệp phải thông báo lại bằng văn bản cho các cơ quan này.
Doanh nghiệp phải mở Sổ theo dõi quản lý đồng tiền quy ước, bao gồm các nội dung cơ bản là hình thức đồng tiền quy ước; số lượng, chủng loại đồng tiền quy ước doanh nghiệp mua, tái xuất hoặc tiêu hủy, trong đó cụ thể theo từng mệnh giá và loại ngoại tệ, ngày mua, tái xuất hoặc tiêu hủy, tên nhà sản xuất, cung cấp; các nội dung khác theo yêu cầu quản lý của doanh nghiệp.
Bộ Công an bắt đầu cấp hộ chiếu mới, người dùng hộ chiếu cũ phải chuyển sang hộ chiếu gắn chip điện tử hay không?",https://cafef.vn/mot-so-quy-dinh-ve-kinh-doanh-tro-choi-dien-tu-co-thuong-danh-cho-nguoi-nuoc-ngoai-20220704092548543.chn
15,30-06-2022 - 15:14 PM,Ra mắt liên minh các nhà sản xuất và phát hành trò chơi điện tử trên mạng tại Việt Nam,"Ngày 30/6/2022, sự kiện ra mắt Liên minh các nhà sản xuất và phát hành trò chơi điện tử trên mạng tại Việt Nam sẽ chính thức được diễn ra tại Trung tâm Hội Nghị triển lãm White Palace, 194 Hoàng Văn Thụ, phường 9, quận Phú Nhuận, thành phố Hồ Chí Minh. Sự kiện thu hút khoảng 200 khách mời tham gia gồm các nhà quản lý, phát hành game, đại diện cơ quan truyền thông, các hiệp hội về kinh tế và thương mại điện tử, các quỹ đầu tư trong và ngoài nước, cũng như các tổ chức Blockchain uy tín tại Việt Nam.","TIN MỚI
Dưới sự chỉ đạo định hướng và đồng hành của Bộ Thông tin và Truyền thông, Cục Phát thanh, truyền hình và thông tin điện tử, năm 2021, Liên minh các nhà sản xuất và phát hành trò chơi điện tử trên mạng tại Việt Nam đã chính thức được thành lập với tên gọi VGDA (Vietnam Game Development Alliance).
Đại diện Lãnh đạo Cục Phát thanh, truyền hình và thông tin điện tử chụp ảnh với các thành viên đại diện Liên minh các nhà sản xuất và phát hành trò chơi điện tử trên mạng tại Việt Nam
Đến nay, Liên minh đã thu hút và tập hợp được gần 60 thành viên đang hoạt động trong lĩnh vực trò chơi điện tử trên mạng, trong đó Ban Điều phối có 10 thành viên: VNG, Vietnam Esports, GOSU Corp, SohaGame, VTC Game, Gamota, Funtap, Viettel Media, Travellet, Solarplay.
Liên minh các nhà sản xuất và phát hành trò chơi điện tử tại Việt Nam được thành lập trên tinh thần
""Đoàn kết chia sẻ - Không ngừng đổi mới""
để cùng chung tay đóng góp và phát triển Game Việt, bắt kịp xu thế toàn cầu, nâng cao năng lực cạnh tranh với các doanh nghiệp nước ngoài; xây dựng hình ảnh và truyền thông về các hoạt động, đóng góp của ngành cho xã hội.
Trong thời gian qua và sắp tới, VGDA tập trung triển khai các hoạt động chính sau:
- Rà quét, phát hiện các game có dấu hiệu vi phạm (game không phép, vi phạm bản quyền, game cờ bạc, đổi thưởng...) để đề xuất cơ quan quản lý ngăn chặn, gỡ bỏ.
- Tham gia góp ý chính sách để hoàn thiện hệ thống văn bản pháp luật điều chỉnh ngành Game.
- Hợp tác, đẩy mạnh các chương trình ươm mầm tài năng để đầu tư, nâng cao chất lượng nhân lực ngành Game.
- Tổ chức các cuộc triển lãm, cuộc thi viết game và trao giải thưởng cho các nhà sản xuất, phát hành game tại Việt Nam có những thành tích đóng góp tích cực cho ngành Game.
-  Tổ chức các buổi hội thảo chia sẻ kinh nghiệm, tập huấn phổ biến pháp luật và định hướng phát triển ngành game Việt.
Và để hiện thực hóa tầm nhìn, ngay tại sự kiện ra mắt Liên minh sẽ diễn ra buổi Hội thảo
""Tìm hướng phát triển Game Việt trong bối cảnh bùng nổ công nghệ Blockchain, Game NFT tại Việt Nam""
. Tại đây, các nội dung pháp lý về Game truyền thống lẫn Game Blockchain sẽ được các cơ quan quản lý, các hiệp hội, doanh nghiệp Game và các chuyên gia trong ngành thảo luận, nhằm tìm định hướng phát triển của ngành Game tại Việt Nam trong thời gian tới.
Sự kiện ra mắt Liên minh các nhà sản xuất và phát hành Game do Gosu và các thành viên trong Ban Điều phối Liên minh tổ chức kéo dài từ 14h00 đến 17h00 ngày 30/6/2022, được livestream trực tiếp qua fanpage của Liên minh các nhà sản xuất và phát hành Game – VGDA.
Thiệt hại hàng tỷ USD vì hàng giả, các nhãn hàng xa xỉ tìm đến blockchain để xác thực sản phẩm",https://cafef.vn/ra-mat-lien-minh-cac-nha-san-xuat-va-phat-hanh-tro-choi-dien-tu-tren-mang-tai-viet-nam-20220630143652089.chn
16,12-06-2022 - 14:37 PM,"TP.HCM có 4 quán cà phê “bán vé” quay về tuổi thơ: Có đủ từ xí muội, kẹo C, mì trẻ em đến trò chơi điện tử chứa chan kỉ niệm","Bạn có còn nhớ gói mì trẻ em thơm giòn, ăn hoài không chán hay những viên kẹo C chua chua ngọt ngọt không? Nếu 1 ngày bỗng dưng nhớ tuổi thơ mình thì hãy ghé 4 quán cà phê dưới đây để được ăn lại những món này nhé.","TIN MỚI
Bây giờ, các quán cà phê ở TP.HCM nhiều không đếm xuể, cứ mỗi năm lại thấy xuất hiện thêm 1 vài quán mới, phong cách từ Âu đến Á, từ hiện đại đến cổ điển, không thiếu gì cả, check-in đến mỏi tay luôn. Thế nhưng, bạn đã bao giờ đến thử những quán cà phê mang đậm phong cách hoài cổ kiểu Việt Nam chưa? Trong những quán này, mấy món đồ quen thuộc mà ai cũng từng gắn bó trong suốt tuổi thơ như máy chơi điện tử, tuýp thổi bong bóng hay thậm chí là ""thiên đường"" ăn vặt tuổi thơ như xí muội, kẹo bọc đường, mì trẻ em,… được tái hiện lại đầy đủ.
Hôm nào thấy nhớ những món tuổi thơ, tò mò không biết hương vị có gì thay đổi sau nhiều năm không thì nhớ lưu lại những quán dưới đây nhé!
CÀ PHÊ MƯA RÀO
Địa chỉ: 115/174B Lê Văn Sỹ, P. 13, Q. Phú Nhuận
Mở cửa: 9h - 22h
Menu: 25k - 45k
Nói đến những quán cà phê đưa bạn quay về với tuổi thơ thì không thể thiếu đi quán Mưa Rào nằm trong con hẻm nhỏ trên đường Lê Văn Sỹ. Nhìn từ bên ngoài, quán giống như 1 gian nhà của ông bà ngày xưa với khung cửa sổ xanh, nền lát gạch hoa. Nội thất cũng chỉ vỏn vẹn vài bộ bàn ghế gỗ để khách ngồi lại uống nước, kệ trưng bày, tủ tivi. Thế nhưng, cam đoan rằng bất kì ai thuộc thế hệ 8x, 9x bước vào cũng đều cảm thấy thân thuộc.
Ảnh: @hquanfood
Menu nước của quán ngoài những món thịnh hành hiện nay như trà sữa, cà phê, trà đào,… thì còn có riêng 1 list các món phổ biến của mấy thập niên trước. Chẳng hạn như sương sa hột é, chanh muối, sâm dứa sữa, đá me, tắc xí muội, si rô đá bào. Sau khi gọi nước, bạn sẽ được mang ra 1 khay trà đá với chiếc ly thuỷ tinh có hoạ tiết chấm tròn, cùng với bình trà bằng nhôm của mấy quán nước vỉa hè ngày xưa.
Ảnh: @ansapsaigon, @tebefood, @meoduky
Thêm 1 điểm cộng nữa cho cà phê Mưa Rào khi quán đã tái hiện lại quầy tạp hoá với đầy đủ các món yêu thích của mấy đứa trẻ ngày xưa, nào là xí muội hoa mai, kẹo singum sọc dưa, bột vị trái cây, bánh gấu, ống socola đủ màu, kẹo C,… Những món này lúc nhỏ thường chỉ đủ tiền mua 1 - 2 thứ nhưng bây giờ có thể ""vung tay"" mua hết để thưởng thức lại. Ngoài ra, quán còn có thêm trò chơi điện tử, câu cá, bạn hãy thử chơi 1 lần để quay về tuổi thơ dữ dội nhé.
Ảnh: @whileinsaigon, @tc.hongnhung, @cloudie.np
CÀ PHƠ QUÁN
Địa chỉ: 127B Lê Văn Duyệt, P. 3, Q. Bình Thạnh
Mở cửa: 9h - 22h
Menu: 10k - 39k
Một quán cà phê tuổi thơ ở TP.HCM mà bạn không thể bỏ lỡ nếu đang nhớ hương vị của mấy món ăn, thức uống ""cộp mác"" 8x, 9x. Tuy chỉ là 1 quán bán nhỏ nhưng về thiết kế, menu và chất lượng được Cà Phơ đầu tư rất gì và này nọ.
Ảnh: @tebetravelmade, Trần Ngọc Quí, @_im.tron_, @phuongle_3001
Bước chân vào quán, bạn sẽ có cảm giác như mình vừa được quay ngược về tuổi thơ. Bên này là bộ bàn ghế gỗ cũ, bên kia là những tờ báo giấy, những món quà vặt quen thuộc mà tuổi thơ ai cũng từng ăn qua. Không gian quán không quá rộng nhưng vẫn có chỗ ngồi bên trong và ngoài trời cho mọi người dễ lựa chọn. Mọi thứ đều được chăm chút rất tỉ mỉ, ngay cả menu của quán cũng được viết tay trong quyển vở ô ly ngày xưa. Đồ uống tại Cà Phơ xoay quanh các món cơ bản như trà, cà phê, cacao. Bên cạnh đó, bạn có thể gọi thêm những món ăn vặt như hạt hướng dương, bánh tai heo, bánh men và nhất định phải thử món bánh mì kẹp kem làm nên tên tuổi của quán.
Ảnh: Trần Ngọc Quí, @tebetravelmade
Hôm nào hãy cùng bạn bè đến đây để tận hưởng 1 ly cà phê và nhâm nhi lại vài món bánh ngày xưa xem hương vị có thay đổi gì không nhé!
XÌ PHỐ XƯA
Địa chỉ: 148 Hiền Vương, P. Tây Thạnh, Q. Tân Phú
Mở cửa: 9h - 23h
Menu: 20 - 105k
Nếu bạn đang muốn tìm 1 quán vừa có thể uống cà phê, vừa có thể nhâm nhi những món ăn ngon thì Xì Phố Xưa là địa chỉ dành riêng cho bạn. Thiết kế của quán mang đậm nét cổ xưa, từ màu sơn tường vàng đậm, khung cửa sổ xanh cho đến những món đồ decor đúng chất ""một nghìn chín trăm hồi đó"" như radio, tủ đựng gỗ,… Chắc chắn sẽ khiến không ít người phải khoe ngay với mấy đứa bạn đi cùng: ""Ê hồi nhỏ nhà tui cũng có cái này nè"".
Ảnh: Nguyen Anh Kiet
Menu ở đây khá đa dạng, bao gồm các món trà, cà phê, soda,… Đặc biệt hơn, những món uống ở đây đều đi kèm với topping thạch dừa - 1 món ăn vặt gây ""nghiện"" cực cao thời 8x, 9x. Nếu bạn muốn cảm nhận lại những hương vị ngày xưa thì quán có luôn 1 quầy tạp hoá nho nhỏ bán tất tần tật các món bánh kẹo, đồ chơi tuổi thơ cho bạn tha hồ chọn lựa.
Ảnh: Tiểu Linh, Ái Ngọc
Ngoài các loại thức uống, quán còn bán thêm những món ăn đậm chất Việt Nam như cá kho, canh chua, tôm rim,… được bày trí trong đĩa sành, niêu đất rất đẹp mắt. Vừa ăn, vừa uống, vừa được quay về tuổi thơ, còn chờ gì mà không rủ rê bạn bè cùng tới ôn lại chuyện cũ liền.
Ảnh: @ancungminhne._
CAM CAM KAFE
Địa chỉ: 806/5E Nguyễn Trãi, P. 14, Q. 5
Mở cửa: 9h - 22h
Menu: 25k - 70k
Ẩn mình trong 1 chung cư cũ tại khu vực Chợ Lớn, Cam Cam Kafe sở hữu không gian mang đậm chất xưa cũ, khéo léo gợi lại kí ức ngày bé với những món đồ quen thuộc như băng cassette, radio, đèn dầu, tivi hộp,… Quán được chia làm 2 tầng, tầng dưới không khí mát mẻ, phù hợp để trò chuyện cùng bạn bè. Tầng trên với view ban công cực chill dành cho những ai thích vừa uống nước vừa ngắm cảnh.
Ảnh: @camcam_kafe
Menu tại Cam Cam Kafe cũng rất phong phú với các món như cà phê, trà, nước cam, tắc xí muội, soda,… được biến tấu nhiều hương vị. Món nước ""best seller"" ở quán mà bạn nên thử chính là bạc xỉu cam 4 tầng, mỗi tầng mang 1 vị khác nhau, khá độc đáo.
Ảnh: Pham Dinh Nhan, @ndh.an, @camcam_kafe
Ngoài ra, khi đến đây, bạn sẽ được thưởng thức lại các món ăn vặt ""thần thánh"" ngày còn bé như bánh gấu, kẹo socola màu mè, bánh tai heo, xí muội hoa mai,… Hoặc muốn ăn no hơn 1 tí, bạn có thể gọi mì thố, mì khô, bánh, mứt. Đảm bảo món nào ăn cũng bắt vị.
Ảnh: Phan Phước, @thesolargallery
Cây viết uy tín của Traveller gợi ý 9 trải nghiệm nên có 1 lần trong đời: Phượt xuyên Việt được gọi tên, sánh vai cùng các tour quốc tế",https://cafef.vn/tphcm-co-4-quan-ca-phe-ban-ve-quay-ve-tuoi-tho-co-du-tu-xi-muoi-keo-c-mi-tre-em-den-tro-choi-dien-tu-chua-chan-ki-niem-20220612105017802.chn
17,06-04-2022 - 21:06 PM,"Từ 0h ngày 8/4, Hà Nội mở lại quán karaoke, massage, bar, trò chơi điện tử","Từ 0h ngày 8/4, Hà Nội cho phép các loại hình kinh doanh dịch vụ như karaoke, massage, quán bar, trò chơi điện tử, Internet được hoạt động trở lạ","TIN MỚI
UBND TP. Hà Nội ngày 6/4 ban hành văn bản về việc điều chỉnh một số biện pháp ""Thích ứng an toàn, linh hoạt, kiểm soát hiệu quả dịch Covid-19"" trong tình hình mới trên địa bàn thành phố.
Theo đó,
từ 0h ngày 8/4, các loại hình kinh doanh dịch vụ như karaoke, massage, quán bar, trò chơi điện tử, internet được hoạt động trở lại
. Các cơ sở này phải bảo đảm các điều kiện theo quy định, các biện pháp phòng, chống dịch Covid-19 theo hướng dẫn của cơ quan y tế và các quy định liên quan.
Đồng thời khuyến cáo khách hàng khi có các biểu hiện nghi ngờ bệnh như ho, sốt, khó thở, mất vị giác... không sử dụng dịch vụ và tham gia các hoạt động tại các địa điểm trên, cần đến các cơ sở y tế để được tư vấn và hướng dẫn.
Hà Nội yêu cầu các sở, ban, ngành, các đơn vị, tổ chức và người dân trên địa bàn thành phố thực hiện nghiêm các biện pháp phòng, chống dịch Covid-19 trên địa bàn thành phố trong tình hình mới, đặc biệt khuyến cáo 5K của Bộ Y tế (trong đó thực hiện nghiêm việc đeo khẩu trang và khử khuẩn). Các cơ quan, đơn vị thường xuyên tự đánh giá nguy cơ và thực hiện các biện pháp phòng, chống dịch theo quy định.
UBND thành phố giao các sở, ngành thành phố: Văn hóa và Thể thao, Lao động - Thương binh và Xã hội, Công Thương, Công an thành phố... căn cứ chức năng nhiệm vụ quản lý nhà nước về nội dung chuyên ngành hướng dẫn, tổ chức các hoạt động nêu trên bảo đảm đúng quy định. Tăng cường công tác kiểm tra xử lý các vi phạm phòng, chống dịch Covid-19.
UBND các quận, huyện, thị xã chịu trách nhiệm phối hợp các sở, ngành có liên quan kiểm tra các cơ sở kinh doanh dịch vụ nêu trên đủ điều kiện và hướng dẫn, tổ chức các hoạt động nêu trên bảo đảm đúng các quy định của pháp luật và an toàn phòng, chống dịch Covid-19.
Từ 0h ngày 8/4, Hà Nội mở lại quán karaoke, massage, bar, trò chơi điện tử
Trước đó, tại Hội nghị giao ban công tác quý I/2022 sáng 6/4, ông Chu Ngọc Anh, Chủ tịch UBND TP. Hà Nội một lần nữa khẳng định thành phố đã qua đỉnh dịch Covid-19. Từ nền tảng kiểm soát tốt dịch bệnh, Thường trực Thành uỷ thống nhất sẽ cho mở thêm một số dịch vụ nữa để phục vụ phục hồi sản xuất kinh doanh.
Theo ông Chu Ngọc Anh, trong đỉnh dịch, số ca mắc Covid-19 tăng rất cao, đặt ra lo lắng về quá tải hệ thống y tế cơ sở. Các trạm y tế phường dù nhiều cán bộ mắc Covid-19 nhưng đã được các lực lượng đoàn thể, mạng lưới bác sĩ đồng hành… chi viện kịp thời. Thành phố kiên định với mục tiêu kiểm soát tỷ lệ chuyển tầng và tử vong.
Chủ tịch Hà Nội nhấn mạnh, quý I/2022, thành phố đã nỗ lực kiểm soát dịch bệnh, phục hồi kinh tế - xã hội mạnh mẽ và hiệu quả. Bên cạnh đó, Chiến dịch tiêm mùa xuân với các tổ lưu động đã đến tận nhà hoàn thành tiêm cho gần 120.000 người có nguy cơ cao. Hà Nội cũng đã tiêm trên 16 triệu mũi vaccine phòng Covid-19. Người từ 12 tuổi trở lên cơ bản đã tiêm 99,5%; mũi 3 hơn 86%.
Ông Chu Ngọc Anh khuyến cáo không quên nhiệm vụ chống dịch khi virus SARS-CoV-2 đang xuất hiện biến thể mới. Hà Nội cần tiếp tục chống dịch từ sớm, từ xa, chủ động phòng ngừa hiệu quả.
Qua đỉnh dịch, số ca Covid-19 tại Hà Nội giảm mạnh, ngày 6/4 ghi nhận hơn 4.000 ca. Dù Omicron ""tàng hình"" chiếm ưu thế, nhưng số bệnh nhân ở tầng 2 và 3 có chiều hướng giảm, tỷ lệ F0 nhập viện chỉ chiếm 1-1,5%.
Từ ngày 15/3, Hà Nội ""hồi sinh"" cho phép nhiều dịch vụ được mở cửa trở lại, như nhà hàng, quán ăn uống được hoạt động bình thường (không quy định đóng cửa trước 21h hàng ngày), mở lại các không gian phố đi bộ, trẻ từ lớp 1 - 6 đến trường từ ngày 6/4.
https://kenh14.vn/tu-0h-ngay-8-4-ha-noi-mo-lai-quan-karaoke-massage-bar-tro-choi-dien-tu-20220406182152257.chn",https://cafef.vn/tu-0h-ngay-8-4-ha-noi-mo-lai-quan-karaoke-massage-bar-tro-choi-dien-tu-20220406210558773.chn
18,12-02-2022 - 20:27 PM,"Từ hôm nay, kinh doanh trò chơi điện tử có thưởng cho người nước ngoài phải gắn camera","Điểm kinh doanh trò chơi điện tử có thưởng dành cho người nước ngoài bắt buộc phải lắp camera để theo dõi, giám sát thường xuyên toàn bộ hoạt động 24/24 giờ trong ngày, theo Nghị định 121/2021/NĐ-CP vừa được Chính phủ ban hành.","TIN MỚI
Chính phủ vừa ban hành Nghị định 121 về kinh doanh trò chơi điện tử có thưởng dành cho người nước ngoài. Nghị định này có hiệu lực từ 12/2/2022 quy định về việc kinh doanh và quản lý hoạt động kinh doanh trò chơi điện tử có thưởng dành cho người nước ngoài trên lãnh thổ Việt Nam.
Theo đó, doanh nghiệp kinh doanh trò chơi điện tử có thưởng chỉ được phép tổ chức các trò chơi điện tử có thưởng tại một Điểm kinh doanh duy nhất được cơ quan quản lý nhà nước có thẩm quyền cấp phép kinh doanh theo quy định của pháp luật.
Cụ thể, điểm kinh doanh phải đáp ứng đầy đủ các điều kiện sau:
- Được bố trí cách ly ra khỏi các khu vực tổ chức hoạt động kinh doanh khác của doanh nghiệp và có cửa ra, vào riêng;
- Có các thiết bị điện tử và hệ thống camera để theo dõi, giám sát thường xuyên toàn bộ hoạt động trong Điểm kinh doanh (24/24h).
Các hình ảnh phải được lưu trữ đầy đủ trong thời hạn tối thiểu 180 ngày kể từ ngày ghi hình và đảm bảo hình ảnh rõ nét tại các vị trí: khu vực cửa ra, vào Điểm kinh doanh; khu vực bố trí các máy trò chơi điện tử có thưởng; khu vực thu ngân, kho quỹ kiểm đếm tiền mặt, đồng tiền quy ước và lưu giữ thiết bị đựng tiền mặt, đồng tiền quy ước.
- Tuân thủ điều kiện về an ninh, trật tự theo quy định của pháp luật về an ninh, trật tự đối với một số ngành, nghề đầu tư kinh doanh có điều kiện.
- Có niêm yết đầy đủ nội quy ra, vào bằng tiếng Việt, tiếng Anh và tiếng nước ngoài khác (nếu có) ở vị trí dễ nhận biết tại cửa ra, vào Điểm kinh doanh.
Nghị định này có hiệu lực từ ngày 12/02/2022. Trong thời hạn 180 ngày, kể từ ngày Nghị định này có hiệu lực thi hành, doanh nghiệp phải nâng cấp hệ thống camera theo dõi, giám sát điểm kinh doanh đáp ứng quy định trên.
Chính sách mới về giờ làm, tiền lương có hiệu lực từ tháng 2/2022 người lao động cần biết
https://cafef.vn/tu-hom-nay-kinh-doanh-tro-choi-dien-tu-co-thuong-cho-nguoi-nuoc-ngoai-phai-gan-camera-20220212202722241.chn",https://cafef.vn/tu-hom-nay-kinh-doanh-tro-choi-dien-tu-co-thuong-cho-nguoi-nuoc-ngoai-phai-gan-camera-20220212202722241.chn
19,02-07-2021 - 10:00 AM,FLC Sầm Sơn vận hành dịch vụ trò chơi điện tử có thưởng,Tập đoàn FLC vừa nhập về một số thiết bị đầu tiên để phục vụ cho kế hoạch vận hành khu trò chơi điện tử có thưởng dành cho người nước ngoài tại quần thể nghỉ dưỡng FLC Sầm Sơn (Thanh Hoá).,"TIN MỚI
Trước đó, theo Giấy chứng nhận của Bộ Tài chính, FLC được phép kinh doanh dịch vụ trò chơi điện tử có thưởng dành cho người nước ngoài tại tầng 1 khách sạn FLC Grand Hotel Samson (quần thể FLC Sầm Sơn, Thanh Hoá) từ năm 2020.
Số lượng máy trò chơi điện tử tối đa mà doanh nghiệp được nhập về để phục vụ kinh doanh là 117 máy. Giấy chứng nhận có hiệu lực trong vòng 10 năm từ ngày được cấp phép và có thể gia hạn theo quy định của pháp luật.
FLC Grand Hotel Samson là khách sạn 5 sao thứ hai của quần thể du lịch FLC Sầm Sơn. Đây là quần thể du lịch 5 sao đầu tiên tại Thanh Hoá, bao gồm khu biệt thự biển, khu khách sạn, trung tâm hội nghị quốc tế 1.300 chỗ, gần 20 nhà hàng quán bar đa dạng, sân golf 18 hố và hệ thống hơn 150 bể bơi, được xây dựng trên hàng trăm ha đầm lầy hoang sơ, nơi giao điểm của biển Sầm Sơn và sông Mã.
Được đưa vào vận hành từ tháng 8/2017, FLC Grand Hotel Samson cao 15 tầng, có 588 phòng khách sạn và 2 phòng Tổng thống. Toàn bộ phòng của khách sạn đều có tầm nhìn hướng biển.
Bên cạnh việc thừa hưởng các tiện ích chung của quần thể FLC Sầm Sơn, FLC Grand Hotel Samson còn được trang bị thêm nhiều tiện ích cao cấp như hệ thống quán bar, cafe, bể bơi vô cực...
Việc khánh thành và đưa vào sử dụng FLC Grand Hotel Samson đã nâng cao năng lực phục vụ của FLC Sầm Sơn lên trên 1.000 phòng, đáp ứng hiệu quả cho việc tổ chức các sự kiện quốc gia và quốc tế, đồng thời bổ sung thêm hạ tầng du lịch cao cấp cho Sầm Sơn – một trong những thành phố biển hấp dẫn du khách hàng đầu Việt Nam.",https://cafef.vn/flc-sam-son-chuan-bi-van-hanh-dich-vu-tro-choi-dien-tu-co-thuong-2021070117210028.chn
