No,Date,Title,Summary,Content,Link
10,13-12-2022 - 10:30 AM,Quản lý thuế trò chơi điện tử - Làm sao để hiệu quả?,"Việt Nam là một cường quốc trò chơi trực tuyến của khu vực, có vai trò nhất định ở các khâu thiết kế, sản xuất, phát hành song lợi ích mang về lại rất thấp.","TIN MỚI
Năm nay, các công ty khởi nghiệp, trong đó có cả những doanh nghiệp sản xuất trò chơi trực tuyến của Việt Nam đã nhận được số vốn khoảng 416 triệu USD. Nhưng đáng nói, chỉ khoảng 20% trong số đó có trụ sở ở Việt Nam, còn lại đều ở nước ngoài. Thông tin vừa được Bộ Thông tin và Truyền thông công bố.
Doanh thu hàng trăm triệu USD mỗi năm, nhưng phần lớn các cá nhân, tổ chức làm game... sẽ đóng thuế cho nước ngoài. Nhiều công ty khởi nghiệp do người Việt sáng lập, kinh doanh tại thị trường Việt Nam... nhưng lập công ty ở nước ngoài, dẫn đến truy thu thuế khó khăn.
Theo thống kê của Cục Phát thanh Truyền hình và Thông tin Điện tử, Bộ Thông tin và Truyền thông, ngành kinh doanh trò chơi tại Việt Nam tăng trưởng mạnh mẽ. Tại Việt Nam, ước tính khoảng gần 28.5 triệu người chơi. Doanh thu ngành này tại Việt Nam năm ngoái đạt khoảng 665 triệu USD, xếp thứ 5 khu vực Đông Nam Á .
Doanh thu các trò chơi sản xuất tại Việt Nam phát hành ở thị trường toàn cầu lên đến 200 triệu USD/năm. 50% tựa trò chơi di động được chơi nhiều nhất có nguồn gốc từ Việt Nam, 5/10 công ty trò chơi hàng đầu châu Á - Thái Bình Dương và Australia là của Việt Nam. Tuy nhiên, số tiền đóng thuế cho Nhà nước chỉ chiếm một nửa, còn lại là các cá nhân, tổ chức đóng thuế cho nước ngoài, chủ yếu là ở Singapore.
Hiện chỉ có khoảng 15% những sản phẩm trò chơi trực tuyến có độ khó rất cao tại Việt Nam có nguồn gốc trong nước, phần còn lại chủ yếu từ Trung Quốc, Nhật Bản, Hàn Quốc… Đây là những nơi mà ngành công nghiệp trò chơi trực tuyến (game online) là một trong những ""đầu tàu"", thúc đẩy sự phát triển của toàn bộ ngành công nghệ thông tin. Do đó, chính phủ các nước này đã có nhiều chính sách ưu đãi, hỗ trợ nền công nghiệp game trong nước, trong đó có các chính sách thuế.
Từ cuối những năm 90 của thế kỷ 20, chính phủ Hàn Quốc đã đầu tư mạnh cho ngành game online, đồng thời tạo nhiều thuận lợi trên các phương diện như chính sách hay thu thuế…
Ngành game nước này cũng không ngần ngại đầu tư để ngày một hoàn thiện hệ sinh thái của mình, với các bước đi nhằm chuyên nghiệp hóa lĩnh vực thể thao điện tử (Esports). Nhờ đó, ngành công nghiệp này của Hàn Quốc đến nay đã trở thành một vòng tròn sinh thái hoàn chỉnh, từ khâu sản xuất ban đầu cho tới khâu bảo hộ bản quyền sản phẩm đều có những chính sách quy định chặt chẽ.
Tại Nhật Bản, các sản phẩm game online không phải là sản phẩm hạn chế tiêu dùng và do đó không phải chịu một sắc thuế đặc biệt nào. Nhật Bản cũng không yêu cầu các công ty kinh doanh game online phải có giấy phép khi phát hành game… mà chỉ tuân theo các quy định chung của ngành giải trí truyền thông.
Còn tại Trung Quốc, Chính phủ nước này cũng cực kỳ chú trọng việc phát triển ngành công nghệ thông tin nội địa nói chung và ngành công nghiệp game nói riêng. Từ giữa những năm 2000, nước này đã có các chính sách nhằm phát triển chất lượng nguồn nhân lực trong ngành công nghiệp game online cũng như chất lượng các công ty phát triển game. Ngành game online của Trung Quốc được hưởng đầy đủ các chính sách ưu đãi về thuế hay trợ cấp như các ngành dịch vụ phần mềm khác. Đó là nền tảng thuận lợi để ngành công nghiệp game của nước này phát huy thế mạnh, vươn lên dẫn đầu ngành công nghiệp game toàn cầu về doanh thu từ năm 2016.
Trong thời gian gần đây, tài sản số đã trở thành mối quan tâm của giới đầu tư và công nghệ trên khắp thế giới. Tại Việt Nam, làn sóng này cũng bắt đầu lan rộng. Kéo theo đó, những loại hình trò chơi trực tuyến tạo ra tài sản số (gọi là game NFT) cũng nở rộ. Năm ngoái, Việt Nam còn được vinh danh ở top đầu thị trường game NFT thế giới khi có một game thương hiệu Việt đạt hơn 1,5 triệu người chơi trên toàn cầu, vừa giải trí vừa kiếm thu nhập.
Tuy nhiên, khung pháp lý vẫn chưa được xác lập, khiến loại hình này rơi vào ""khoảng trống"" pháp lý.
Có gần 10 năm kinh nghiệm phát triển trò chơi di động, anh Đinh Trọng Dũng và Studio game của mình là một trong các nhà phát hành tham gia sớm vào việc phát triển game metaverse và phát hành NFT tại Việt Nam. Nhiều dự án của Dũng được các nhà đầutư quốc tế quan tâm, sẵn sàng bỏ vào hàng trăm nghìn USD. Tuy nhiên, việc thiếu những khung pháp lý cơ bản liên quan đến tài sản số khiến Dũng chưa thể nhận đầu tư.
Anh Đinh Trọng Dũng, nhà sáng lập Metal Game Studio, nói: ""Khi thiếu các khung pháp lý thì nhà đầu tư không được bảo đảm, khiến họ ngần ngại tham gia vào dự án, làm chúng tôi cũng có thể vuột mất cơ hội của mình. Tôi biết có một số dự án muốn nhận đầu tư thì phải đưa sang Singapore chứ không đứng tên người Việt nữa"".
Anh Đặng Vương Anh, cố vấn blockchain Công ty cổ phần công nghệ NTQ Solution, cho biết: ""Chỉ xét riêng về lĩnh vực NFT thì khối lượng giao dịch của thị trường năm 2021 đã đạt 25 tỷ USD trong khi năm 2020 nó mới chỉ đạt 100 triệu USD. Như vậy, lĩnh vực này đã tăng trưởng mức hơn 100 lần chỉ trong vòng 1 năm. Nếu xét về thuế đối với một nước chưa có Luật quy định cụ thể như Việt Nam thì sự thất thoát thuế là rất lớn"".
Chính sách thuế rõ ràng là cần thiết, song đây chưa phải là điều kiện duy nhất để quyết định chất lượng phát triển của ngành công nghiệp game tại Việt Nam. Theo Bộ Thông tin và Truyền thông, các doanh nghiệp game tại Việt Nam vẫn đang sản xuất, phát hành trò chơi điện tử trên cơ sở hoạt động độc lập, chưa có sự gắn kết với nhau, để cùng thúc đẩy ngành công nghiệp này phát triển, đồng thời, Bộ Thông tin và Ttruyền thông sẽ xem xét giới hạn game nước ngoài; thí điểm chính sách quản lý trên công nghệ blockchain... để ngành công nghiệp này đi đúng hướng, loại bỏ nguy cơ xấu từ game lậu và thất thu ngân sách.
Nhà sáng lập FTX bị bắt",https://cafef.vn/quan-ly-thue-tro-choi-dien-tu-lam-sao-de-hieu-qua-20221213100553821.chn
11,24-10-2022 - 09:09 AM,Con đường trở thành tỷ phú của ông chủ NetEase: Là người giàu nhất Trung Quốc ở tuổi 32 nhờ trò chơi điện tử,"William Lei Ding là nhà sáng lập đồng thời là Giám đốc điều hành của NetEase, một trong những công ty kinh doanh về lĩnh vực game online lớn nhất thế giới. Nhờ vào trò chơi điện tử, Lei Ding đã trở thành người giàu nhất Trung Quốc vào năm 2003 khi mới chỉ 32 tuổi.","TIN MỚI
William Lei Ding (hay còn gọi là Đinh Lỗi) là một doanh nhân, tỷ phú người Trung Quốc. Ông là nhà sáng lập đồng thời là Giám đốc điều hành của NetEase, một trong những công ty kinh doanh về lĩnh vực game online lớn nhất thế giới.
Về tiểu sử, Lei Ding sinh ra Ninh Ba, tỉnh Chiết Giang. Ông tốt nghiệp Học viện Kỹ thuật Vô tuyến Thành Đô (nay là Đại học Khoa học và Công nghệ Điện tử Trung Quốc). Trước khi trở nên giàu có nhờ vào trò chơi điện tử, Ding từng làm việc trong cơ quan chính phủ với tư cách là một kỹ sư.
Sau đó, ông chuyển đến Quảng Châu ở tỉnh Quảng Đông và làm việc tại công ty phân tích phần mềm Sybase có trụ sở tại Hoa Kỳ.
Làm việc ở Sybase một thời gian và có kinh nghiệm trong lĩnh vực công nghệ, Ding mạo hiểm thành lập NetEase vào tháng 6 năm 1997, khi đấy Ding mới chỉ 26 tuổi. Ban đầu mới thành lập, công ty chỉ có 3 nhân viên và không hoạt động trong lĩnh vực trò chơi điện tử.
Thời điểm đầu khi tìm hiểu và nghiên cứu về nhu cầu của thị trường, Lei Ding nhận thấy thị trường Trung Quốc chưa có nhiều phần mềm phục vụ việc chuyển đổi ngôn ngữ sang tiếng Trung. Vì vậy, ông và nhóm của mình đã phát triển một hệ thống phần mềm bằng tiếng Trung cho phép việc chuyển đổi ngôn ngữ dễ dàng và thuận tiện hơn, nhất là trong quá trình sử dụng email.
Ứng dụng này sau đó nhanh chóng trở nên phổ biến trên khắp Trung Quốc. Bên cạnh đó, NetEase còn nổi tiếng là công ty cung cấp dịch vụ lưu trữ cung cấp 163 tên miền email phổ biến vào thời điểm đó. Không mất nhiều thời gian để công ty của Ding có một bước nhảy vọt khi lên sàn trên sàn chứng khoán Nasdaq vào giữa năm 1999-2020.
Tuy nhiên, mặc dù đã huy động được 70 triệu USD trong đợt chào bán lần đầu trên sàn Nasdaq, một năm sau đó NetEase phải đối mặt với một vụ bê bối tài chính khiến cổ phiếu của công ty bị đình chỉ trong 4 tháng.
Trong lúc công ty khó khăn, Ding tìm thấy cơ hội mới về thị trường game, công ty ngay đã đầu tư mạnh vào việc phát triển các trò chơi điện tử trực tuyến. Sự bùng nổ của Internet lúc bấy giờ đã giúp công ty của Ding phát triển mạnh hơn nữa.
Chỉ hai năm sau đó, vào năm 2003, việc kinh doanh trò chơi điện tử đã giúp Ding trở thành người giàu nhất Trung Quốc với khối tài sản 2,95 tỷ USD.
Một trong những trò chơi nổi tiếng của NetEase chính là Series Fantasy Westward Journey, trò chơi lấy cảm hứng từ tiểu thuyết Tây Du Ký thế kỷ 16. Tính đến năm 2015, trò chơi này đã có khoảng 310 triệu người đăng ký. Không chỉ dừng lại ở đó, Ding còn tìm cách phát triển các trò chơi điện tử trên nền tảng di động.
Hiện nay, công ty NetEase nổi tiếng với các trò chơi trực tuyến, dịch vụ email, dịch vụ tin tức và nền tảng thương mại điện tử Kaola.
Theo danh sách những tỷ phú công nghệ giàu nhất năm 2022 được Forbes công bố đầu năm, William Ding Lei xếp thứ 11 với khối tài sản trị giá 25,2 tỷ USD. Ông Ding xếp sau ông chủ của Tencent - Ma Huateng và xếp trên tỷ phú nổi tiếng Jack Ma
Tham khảo: South China Morning Post, Forbes, Bloomberg...
Tỷ phú tự thân Mark Cuban: Tài sản quý giá nhất là thời gian",https://cafef.vn/con-duong-tro-thanh-ty-phu-cua-ong-chu-netease-la-nguoi-giau-nhat-trung-quoc-o-tuoi-32-nho-tro-choi-dien-tu-20221024090935303.chn
12,23-10-2022 - 09:28 AM,Con đường trở thành tỷ phú của ông chủ NetEase: Là người giàu nhất Trung Quốc ở tuổi 32 nhờ trò chơi điện tử,"William Lei Ding là nhà sáng lập đồng thời là Giám đốc điều hành của NetEase, một trong những công ty kinh doanh về lĩnh vực game online lớn nhất thế giới. Nhờ vào trò chơi điện tử, Lei Ding đã trở thành người giàu nhất Trung Quốc vào năm 2003 khi mới chỉ 32 tuổi.","TIN MỚI
William Lei Ding (hay còn gọi là Đinh Lỗi) là một doanh nhân, tỷ phú người Trung Quốc. Ông là nhà sáng lập đồng thời là Giám đốc điều hành của NetEase, một trong những công ty kinh doanh về lĩnh vực game online lớn nhất thế giới.
Về tiểu sử, Lei Ding sinh ra Ninh Ba, tỉnh Chiết Giang. Ông tốt nghiệp Học viện Kỹ thuật Vô tuyến Thành Đô (nay là Đại học Khoa học và Công nghệ Điện tử Trung Quốc). Trước khi trở nên giàu có nhờ vào trò chơi điện tử, Ding từng làm việc trong cơ quan chính phủ với tư cách là một kỹ sư.
Sau đó, ông chuyển đến Quảng Châu ở tỉnh Quảng Đông và làm việc tại công ty phân tích phần mềm Sybase có trụ sở tại Hoa Kỳ.
Làm việc ở Sybase một thời gian và có kinh nghiệm trong lĩnh vực công nghệ, Ding mạo hiểm thành lập NetEase vào tháng 6 năm 1997, khi đấy Ding mới chỉ 26 tuổi. Ban đầu mới thành lập, công ty chỉ có 3 nhân viên và không hoạt động trong lĩnh vực trò chơi điện tử.
Thời điểm đầu khi tìm hiểu và nghiên cứu về nhu cầu của thị trường, Lei Ding nhận thấy thị trường Trung Quốc chưa có nhiều phần mềm phục vụ việc chuyển đổi ngôn ngữ sang tiếng Trung. Vì vậy, ông và nhóm của mình đã phát triển một hệ thống phần mềm bằng tiếng Trung cho phép việc chuyển đổi ngôn ngữ dễ dàng và thuận tiện hơn, nhất là trong quá trình sử dụng email.
Ứng dụng này sau đó nhanh chóng trở nên phổ biến trên khắp Trung Quốc. Bên cạnh đó, NetEase còn nổi tiếng là công ty cung cấp dịch vụ lưu trữ cung cấp 163 tên miền email phổ biến vào thời điểm đó. Không mất nhiều thời gian để công ty của Ding có một bước nhảy vọt khi lên sàn trên sàn chứng khoán Nasdaq vào giữa năm 1999-2020.
Tuy nhiên, mặc dù đã huy động được 70 triệu USD trong đợt chào bán lần đầu trên sàn Nasdaq, một năm sau đó NetEase phải đối mặt với một vụ bê bối tài chính khiến cổ phiếu của công ty bị đình chỉ trong 4 tháng.
Trong lúc công ty khó khăn, Ding tìm thấy cơ hội mới về thị trường game, công ty ngay đã đầu tư mạnh vào việc phát triển các trò chơi điện tử trực tuyến. Sự bùng nổ của Internet lúc bấy giờ đã giúp công ty của Ding phát triển mạnh hơn nữa.
Chỉ hai năm sau đó, vào năm 2003, việc kinh doanh trò chơi điện tử đã giúp Ding trở thành người giàu nhất Trung Quốc với khối tài sản 2,95 tỷ USD.
Một trong những trò chơi nổi tiếng của NetEase chính là Series Fantasy Westward Journey, trò chơi lấy cảm hứng từ tiểu thuyết Tây Du Ký thế kỷ 16. Tính đến năm 2015, trò chơi này đã có khoảng 310 triệu người đăng ký. Không chỉ dừng lại ở đó, Ding còn tìm cách phát triển các trò chơi điện tử trên nền tảng di động.
Hiện nay, công ty NetEase nổi tiếng với các trò chơi trực tuyến, dịch vụ email, dịch vụ tin tức và nền tảng thương mại điện tử Kaola.
Theo danh sách những tỷ phú công nghệ giàu nhất năm 2022 được Forbes công bố đầu năm, William Ding Lei xếp thứ 11 với khối tài sản trị giá 25,2 tỷ USD. Ông Ding xếp sau ông chủ của Tencent - Ma Huateng và xếp trên tỷ phú nổi tiếng Jack Ma
Tham khảo: South China Morning Post, Forbes, Bloomberg...
Thời điểm mà CMND, CCCD mã vạch chính thức bị khai tử",https://cafef.vn/con-duong-tro-thanh-ty-phu-cua-ong-chu-netease-la-nguoi-giau-nhat-trung-quoc-o-tuoi-32-nho-tro-choi-dien-tu-20221023091732819.chn
13,29-07-2022 - 09:15 AM,Từ cậu học sinh bỏ học trung học đến ông chủ công ty trò chơi điện tử 105 triệu USD ở tuổi 32,"Josh Fabian bỏ học trung học, làm cha ở độ tuổi 20 và từng không có tiền để mua tã cho con.","TIN MỚI
Người đàn ông 32 tuổi da đen từng mồ côi và được một cặp vợ chồng da trắng nhận nuôi từ khi còn nhỏ. Và ở mọi nơi, Josh Fabian luôn cảm thấy bị cô lập vì màu da và nghĩ rằng mình phải làm điều gì đó để chứng tỏ bản thân.
“Tôi nhớ mình đã cảm thấy như không tồn tại, cảm giác mình không thích hợp ở bất cứ đâu. Tôi muốn trở nên có ý nghĩa... được coi là người giỏi nhất trong một lĩnh vực nào đó, theo một cách nào đó"", anh chia sẻ.
Theo Fabian, việc bị gạt ra ngoài lề có thể là một động lực mạnh mẽ. Hiện tại, anh là đồng sáng lập và CEO của công ty Metafy có trụ sở tại Pittsburgh. Đây là một nền tảng trực tuyến, mới ra đời được 2 năm, nơi những người chơi video nghiệp dư trả tiền cho các buổi huấn luyện với một số người chơi hàng đầu thế giới.
Kể từ khi ra mắt ở thời kỳ đỉnh điểm của đại dịch Covid-19, Metafy đã thu hút hơn 50.000 người dùng và hàng nghìn huấn luyện viên, bao gồm những người chơi xếp hạng hàng đầu của các trò chơi phổ biến như “”League of Legends” (“Liên minh huyền thoại”) và “Super Smash Bros”. Công ty đã huy động được gần 34 triệu USD từ các nhà đầu tư và được định giá 105 triệu USD vào tháng 2.
Hành trình của Metafy cho đến nay có vẻ giống như một câu chuyện khởi nghiệp thông thường. Nhưng hành trình của Fabian, từ cuộc sống nhờ vào tem phiếu thực phẩm khi còn là một thiếu niên đến khi trở thành một người chơi “Yu-Gi-Oh!” được xếp hạng quốc gia trên toàn nước Mỹ thì chắc chắn là đặc biệt.
Số tiền ""thay đổi cuộc đời""
Ở tuổi 16, Fabian tự rời khỏi cha mẹ nuôi của mình. Anh đã bỏ học trung học và trở thành cha lần đầu tiên ở tuổi 20. Có thời gian, anh và bạn gái khi đó sống nhờ phiếu thực phẩm, thỉnh thoảng phải ăn cắp tã và các đồ dùng khác cho con mình.
Fabian là một lập trình viên tự học. Nguồn thu nhập chính của anh vào thời điểm đó là thiết kế các trang web nhỏ với giá khoảng 100 USD cho mỗi một dự án. Quyết định bản thân cần phải nghiêm túc làm việc để có thể nuôi sống gia đình, Fabian đã trau dồi kỹ năng trong một khóa học viết code kéo dài ba tháng ở Chicago. Điều này đã giúp anh có được công việc thiết kế web với công ty khởi nghiệp thị trường xã hội Obaz vào năm 2012.
Ngoài mức lương 6 con số, Fabian cho biết anh còn có cổ phần trong công ty. Khi Groupon mua lại Obaz hai năm sau đó - với giá khoảng 250.000 USD, theo hồ sơ năm 2015 của SEC - anh đã có cuộc sống dễ chịu hơn.
“Điều đó đã thay đổi cuộc đời tôi”, Fabian nói.
Josh Fabian là CEO và đồng sáng lập của nền tảng huấn luyện chơi game Metafy. Ảnh: Metafy
Sau gần 3 năm làm việc tại Groupon, Fabian rời xa thế giới công nghệ để tập trung vào một niềm đam mê khác: chơi game. Khi còn là một thiếu niên, Fabian đã đạt được thứ hạng quốc gia trong số người chơi “Yu-Gi-Oh!” hàng đầu của nước Mỹ. Đến năm 2016, anh đã dành 8 giờ mỗi ngày để chơi các trò chơi trực tuyến như “Clash Royale” và “Hearthstone”, đồng thời nhìn tên mình dần vươn lên các vị trí cao hơn trong bảng xếp hạng.
Fabian thường xuyên phát trực tiếp các trò chơi của mình trên Twitch và đăng video lên YouTube. Cuối cùng, mọi người đã yêu cầu các buổi huấn luyện riêng . Fabian nói: “Tôi đã kiếm được 100 USD/giờ khi làm công việc đó”.
Trong sáu tháng huấn luyện, Fabian cho biết mình đã kiếm được 40.000 USD. Mặc dù công việc giúp anh kiếm tiền thuận lợi nhưng không đủ tốt để Fabian quyết định từ bỏ sự nghiệp thiết kế web nhiều tiềm năng của mình. Cho đến khi, những canh cánh trong lòng anh nhắc lại cho Fabian một lần nữa về mong muốn chứng minh bản thân mình – và khởi nghiệp dường như là cách khả thi nhất để thực hiện điều đó.
Nhận ra bản thân ""không cô đơn""
Năm 2016, Fabian đã thử tung ra Kitsu, một nền tảng mạng xã hội dành cho những người hâm mộ truyện tranh anime và manga để kết nối với nhau và khám phá những tựa game mới. Khó khăn, hết tiền và Fabian tiếp tục quay lại với ý tưởng huấn luyện trò chơi điện tử.
Vào thời điểm đó, 4 người con của Fabian đang say mê chơi trò chơi thẻ giao dịch trực tuyến “Pokémon”. Fabian đã liên hệ với một số người chơi hàng đầu để xem liệu họ có sẵn lòng huấn luyện những đứa trẻ của anh hay không. Một người đã nhận lời anh chỉ với 20 USD/ một giờ. Số tiền Fabian cho rằng ít hơn cả chi phí một giờ trông trẻ.
Sau đó, Fabian phát hiện ra rằng nguồn thu nhập chính của huấn luyện viên là một công việc mang tính “nội trợ” có mức thu nhập thấp đến khó tin.
Các game thủ đã tự quảng cáo mình là huấn luyện viên trên các nền tảng như GamerSensei và Fiverr, nhưng Fabian cho biết không ai trong số họ cung cấp các dịch vụ cao cấp hoặc nhận được phí đặt chỗ. Anh và Tom McNiven, một kỹ sư phần mềm được Fabian tuyển dụng để giúp xây dựng Kitsu, bắt đầu tìm hiểu chi tiết về một nền tảng mới và lập trình khi rảnh rỗi.
Khi đại dịch xảy ra, hai người đã trình bày ý tưởng này với Product Club, một công ty tăng tốc khởi nghiệp có trụ sở tại San Francisco do cựu Phó chủ tịch Tinder Jeff Morris Jr điều hành. Kết quả là, công ty khởi nghiệp của Fabian đã nhận được 100.000 USD đầu tư.
Số tiền rất có ích tuy nhiên Fabian cho rằng, giá trị thực của việc gọi vốn thành công đó là sẽ có nhiều nhà đầu tư mạo hiểm hơn chú ý đến công ty.
Điều này rất quan trọng: Chỉ có chưa đầy 1% những nhà sáng lập da đen nhận được vốn từ các nhà đầu tư mạo hiểm mỗi năm. Và kể cả những cuộc kêu gọi đầu tư thành công cũng gặp rất nhiều khó khăn.
Những mục tiêu tương lai
Hiện tại, Metafy có được một nguồn doanh thu ổn định: Công ty kiếm tiền từ khoản phí 5% được tính cho mỗi học viên.
Fabian muốn nền tảng của mình cuối cùng sẽ tổ chức “nội dung kiểu MasterClass để chơi game” và các sự kiện nơi huấn luyện viên và học viên có thể gặp gỡ - hoặc thậm chí thi đấu ở đời thực. Anh tuyên bố, Metafy có thể trở thành một công ty khởi nghiệp tỷ USD “trong vòng vài năm tới” và thay đổi vĩnh viễn thực trạng thể thao điện tử, giống như cách Twitch trở nên phổ biến với việc phát trực tuyến.
Các nhà đầu tư của Metafy cho biết, họ tin rằng anh có thể thành công - tuy nhiên họ cũng có những nghi ngại. Đối tác quản lý của Forerunner Ventures, Brian O’Malley, người mà Fabian coi là “là người cố vấn lớn nhất của tôi”, nói rằng bản thân đầu tư vì “sự hiểu biết của Fabian về game thủ - không chỉ những gì họ muốn làm mà còn những gì họ sẽ yêu thích”. Đó là một đặc điểm cần thiết của một nhà sáng lập thành công, theo O’Malley.
Có lẽ đó là lý do tại sao Fabian so sánh tầm nhìn của mình với những ông lớn công nghệ như YouTube và Uber, mặc dù đang điều hành một công ty rất non trẻ mà anh thừa nhận là “thậm chí còn chưa đạt được lợi nhuận”.
Đế chế bất ổn của Mark Zuckerberg: Không thể kiếm được tiền từ thứ gì khác ngoài quảng cáo, sắp phải bán WhatsApp dù từng mua với giá 'cắt cổ' 19 tỷ USD",https://cafef.vn/tu-cau-hoc-sinh-bo-hoc-trung-hoc-den-ong-chu-cong-ty-tro-choi-dien-tu-105-trieu-usd-o-tuoi-32-20220729090204479.chn
