No,Date,Title,Summary,Content,Link
17,"Thứ hai, 29/5/2017, 12:50 (GMT+7)",Trò chơi điện tử - quyền lực 'mềm' của Trung Quốc,Truyền thông phương Tây cho rằng Trung Quốc đang dẫn đầu thế giới ở lĩnh vực game và đây là yếu tố giúp tăng cường sức ảnh hưởng của nước này đối với Mỹ và các quốc gia châu Âu.,"Tencent, công ty Internet lớn nhất Trung Quốc vừa hoàn thành phi vụ mua lại nhà phát triển trò chơi Supercell với giá 8,6 tỷ USD để trở thành hãng phát hành game có tổng trị giá 100 tỷ USD. Supercell là công ty game nổi tiếng của Phần Lan, phát triển các trò chơi đình đám như
Clash of Clans, Clash Royale, Hay Day, Boom Beach..
.
Theo
Bloomberg
, đây là bản hợp đồng lớn tới mức chưa có công ty giải trí nào của Trung Quốc, bao gồm cả trong lĩnh vực truyền hình, điện ảnh và sách báo dám thực hiện. Tuy nhiên, hệ quả của cuộc giao dịch này không đơn thuần là vấn đề kinh tế mà có thể là yếu tố văn hóa.
Trong nhiều năm trở lại đây, chính phủ Trung Quốc đã chi hàng tỷ USD để trợ cấp các doanh nghiệp trong lĩnh vực nghệ thuật (phim ảnh, sách báo, âm nhạc...) với mong muốn hướng tới việc sử dụng ""quyền lực mềm"" vượt ra ngoài biên giới. Tuy nhiên, thành công mang lại không đáng kể. Nhưng trong tình cảnh đó, ngành công nghiệp trò chơi của quốc gia này đã nổi lên một cách mạnh mẽ và đang trên đường trở thành một trong những ngành xuất khẩu văn hoá có giá trị nhất.
Supercell, một trong những công ty làm game di động lớn nhất thế giới đã thuộc về Trung Quốc.
Tại Việt Nam, có thể nhận thấy rõ dấu ấn của các nhà sản xuất game Trung Quốc trong các trò chơi đình đám nhất ở các thể loại. Như thể loại bắn súng với
Đột Kích
trên PC,
Tập Kích, Crossfire Legends
và
Chiến Dịch Huyền Thoại
trên di động; thể loại nhập vai với
Võ Lâm Truyền Kỳ, Cửu Âm Chân Kinh
(cả PC và Mobile); hay game MOBA nhiều người chơi nhất
Liên Minh Huyền Thoại.
Với
Liên Minh Huyền Thoại,
game MOBA đã được Tencent mua lại từ năm 2016, đây đang là trò chơi điện tử đông người tham gia nhất thế giới. Trận chung kết thế giới năm ngoái giữa hai đội Hàn Quốc thu hút tới 36 triệu người xem trực tiếp.
Trò chơi điện tử - quyền lực mềm của Trung Quốc
Tờ
Handelsblatt
của Đức mới đây cũng có bài viết cho rằng trò chơi điện tử là sức mạnh mềm của Trung Quốc và nó đặc biệt hữu ích khi có ảnh hưởng lớn trong giới trẻ.
Ở Trung Quốc, thể thao điện tử có những giải đấu và địa điểm thi đấu đặc thù, cũng như các kênh truyền hình riêng của mình. Một số trò chơi sẽ có mặt tại Á vận hội 2022. Trước đó chúng sẽ được thử nghiệm tại Đại hội Thể thao Châu Á (Asian Games) năm 2018. Alibaba là một trong những công ty tài trợ và thúc đẩy việc này một cách mạnh mẽ. Đây chỉ là một trong nhiều công ty đang xếp hàng dài để chờ đợi tới lượt được tài trợ cho các trò chơi và đội game thi đấu, vì lợi nhuận mang lại là con số khổng lồ.
Bởi Trung Quốc có hơn 400 triệu người chơi các môn eSports trực tuyến và năm 2016, 5 chàng trai trong đội Wings Gaming của nước này vô địch giải đấu
DOTA 2
và nhận 8,6 triệu USD, giải thưởng lớn nhất thế giới dành cho trò chơi điện tử. Không ngoa khi nhiều người nói rằng Trung Quốc đang là quốc gia mạnh nhất về thể thao điện tử, xếp trên cả Mỹ và Hàn Quốc.
Và truyền thông biến các game thủ thành những ngôi sao, với tiền bạc và danh tiếng. Ngược lại các kênh truyền hình về game cũng đang được các nhà đầu tư quan tâm để ý. Năm 2014, Amazon bỏ 1 tỷ USD mua Twitch TV, kênh game có hơn 100 triệu người xem mỗi tháng. Còn hiện nay, kênh game số một Trung Quốc là Betta TV cũng được ước tính có giá trị thị trường lên đến 1 tỷ USD với lượng khán giả hàng tháng là 450 triệu.
Mặc dù các trò chơi trên PC phổ biến nhất ở Trung Quốc thường là các sản phẩm sản xuất hoặc nhập khẩu có nội dung phù hợp với game thủ địa phương, dựa trên chủ đề truyền thống và sử thi như Tây Du Ký hay Tam Quốc, lĩnh vực game trên di động vẫn phát triển và phổ biến theo cách riêng.
Một trong những lý do chính là bởi vì game vẫn chưa chịu sự ảnh hưởng của việc kiểm duyệt nội dung gắt gao như phim ảnh hay truyền hình. Chính quyền nước này không có nhiều lý do để ngăn cấm các nội dung giả tưởng phép thuật hay cuộc chiến giữa quái vật và con người. Điều đó giúp cho các nhà sản xuất phát hành có thể sáng tạo một cách tự do hơn các hình thức nghệ thuật khác.
Tuy nhiên, trước nay các nhà sản xuất game Trung Quốc vẫn tập trung chủ yếu vào thị trường nội địa và bỏ qua đối tượng nước ngoài. Nhưng với tốc độ tăng trưởng và cạnh tranh ngày càng khốc liệt, họ dần phải mở rộng tìm kiếm cơ hội ở các khu vực khác nếu muốn mở rộng thị phần của mình. Đó cũng là lúc mà cuộc chơi trong ngành công nghiệp game trở nên thú vị.
Với việc mua lại Supercell, Tencent sẽ kiểm soát khoảng 13% ngành công nghiệp game toàn cầu. Kế hoạch của hãng là tăng trưởng lượng game thủ hằng ngày từ 100 triệu lên 300 triệu. Nền tảng truyền thông rộng mở của Tencent sẽ có trách nhiệm thúc đẩy và khiến người chơi tương tác nhiều hơn trong các sản phẩm của Supercell.
Hầu hết các trò chơi di động trong top doanh thu tại Việt Nam đều là game Trung Quốc.
Nhưng đó không phải là tất cả. Giới chuyên môn nhận định trong tương lai Tencent có thể thử đẩy một số nhân vật game nổi tiếng vào các rạp chiếu phim, giống như cách mà Disney đã từng thực hiện. Đối thủ lớn của Tencent hiện nay, Blizzard cũng đang thành công với bộ phim
Warcraft
được chuyển thể từ trò chơi điện tử của mình.
""Vẫn còn quá sớm để nói rằng các trò chơi điện tử của Trung Quốc sẽ ảnh hưởng đến văn hoá toàn cầu, nhưng điều này có thể giống như việc cố gắng để dự đoán tác động của Disney trong những năm 1920, hay Marvel Comics vào những năm 1940"",
Bloomberg
ví von. ""Tuy nhiên, không loại trừ việc các nhà sản xuất trò chơi sẽ lồng ghép xuất khẩu các giá trị văn hóa, quan điểm về tiến bộ công nghệ hay nỗi sợ hãi cho tương lai... bằng các hình thức kỳ dị nhất"".
Quyền lực mềm là một loại năng lực, có thể giúp đạt được mục đích thông qua sức hấp dẫn chứ không phải ép bức hoặc dụ dỗ. Sức hấp dẫn này đến từ quan điểm giá trị về văn hoá, chính trị và chính sách ngoại giao của một nước - theo Joseph Nye Jr., giáo sư Đại học Harvard, người được xem là ""cha đẻ"" của khái niệm ""quyền lực mềm"".
Mai Anh",https://vnexpress.net/tro-choi-dien-tu-quyen-luc-mem-cua-trung-quoc-3591686.html
18,"Thứ ba, 17/12/2019, 11:00 (GMT+7)",Gold Game Việt Nam cung cấp dịch vụ trò chơi điện tử trực tuyến,"Chiến lược của công ty là phát triển các game giải trí cho mọi lứa tuổi, game về giáo dục có ích cho học sinh, sinh viên.","Công ty Cổ phần Gold Game Việt Nam tổ chức lễ công bố hoạt động cung cấp dịch vụ trò chơi điện tử trên mạng hôm 15/12. Ông Nguyễn Văn Anh - Chủ tịch HĐQT, Tổng giám đốc Gold Game Việt Nam cho biết, phần mềm trò chơi điện tử của công ty đã được Cục bản quyền cấp phép.
Lễ công bố cung cấp dịch vụ trò chơi điện tử trên mạng của Gold Game Việt Nam.
Theo lãnh đạo công ty, trò chơi dự đoán có thưởng của Gold Game Việt Nam không có thể lệ đặt cược. Người chơi thực hiện theo quy tắc trên hệ thống. ""Chúng tôi sản xuất game, kinh doanh các game dự đoán có thưởng chứ không phải là tổ chức cá cược"", ông nói.
Tại sự kiện, công ty ký kết hợp tác toàn diện với Công ty Cổ phần Đầu tư Phát triển Công nghệ Trí Nam để triển khai cơ sở hạ tầng công nghệ thông tin chất lượng cao, với dự án VietShare.
Thông qua ứng dụng VietShare trên điện thoại di động, dự án đặt mục tiêu khuyến khích người dân tích cực sử dụng xe đạp, hạn chế ôtô, xe máy nhằm giảm thiểu khói bụi gây ô nhiễm môi trường
.
Doanh nghiệp kỳ vọng dự án sẽ thu hút sự quan tâm của đông đảo người dân cùng chung tay bảo vệ môi trường.
Ứng dụng dự kiến ra mắt vào quý I/2020.
Đại diện Gold Game Việt Nam (trái) và công ty Trí Nam.
Hiện Gold Game Việt Nam tiếp tục xây dựng và hoàn thiện cơ sở hạ tầng, công nghệ, website. Công ty dự kiến sẽ chính thức đi vào hoạt động kinh doanh trong đầu năm 2020.
Công ty Cổ phần Gold Game Việt Nam chủ yếu hoạt động trong lĩnh vực cung cấp các sản phẩm sáng tạo, dịch vụ giải trí và giải pháp tiện ích.
Minh Chi",https://vnexpress.net/gold-game-viet-nam-cung-cap-dich-vu-tro-choi-dien-tu-truc-tuyen-4028278.html
19,"Thứ hai, 22/7/2019, 14:41 (GMT+7)",Griezmann: 'Barca như có mã gian lận trong trò chơi điện tử',Tân binh Antoine Griezmann hào hứng khi được chơi cho một đội bóng có hàng loạt cầu thủ tài năng.,"""Barca đang xây dựng một đội bóng như có mã gian lận trong trò chơi điện tử: Luis Suarez, Messi, Dembele, Frenkie de Jong"", Griezmann chia sẻ trên tờ
Marca
.
Griezmann đang khao khát thành công với Barca. Ảnh:
DS
""Mã gian lận"" (cheat code) mà Griezmann đề cập đều là những cầu thủ hàng đầu thế giới (Suarez, Messi), hoặc là những tài năng trẻ nhận được nhiều kỳ vọng (Dembele, De Jong).
Bản thân Griezmann cũng là một trong những cầu thủ hàng đầu, vị thế khiến Barca phải bỏ ra 135 triệu đôla để mua về. Có sự phục vụ của ngôi sao từng ghi hàng trăm bàn cho Atletico và Sociedad, đội chủ sân Nou Camp hy vọng có thể giành cả La Liga lẫn Champions League mùa tới.
""Chúng tôi có một đội bóng mạnh với những cầu thủ tuyệt vời. Chúng tôi sẵn sàng khiến người hâm mộ và bản thân chúng tôi hạnh phúc"", Griezmann nhấn mạnh.
Giống những gì từng diễn ra với Thierry Henry, Samuel Eto'o, David Villa, Neymar và Suarez, việc được chơi cạnh Messi có thể giúp Griezmann gia tăng số bàn thắng cũng như danh hiệu. Nếu thành công, tiền đạo 28 tuổi có thể sẽ giành những danh hiệu chưa từng có trong sự nghiệp cấp CLB như La Liga, Champions League, FIFA Club World Cup.
""Tôi nghĩ sẽ thật tuyệt khi được chơi cạnh Messi. Tôi rất phấn khích khi thấy những gì anh ấy làm hàng ngày. Tôi sẽ cố gắng hòa nhập với anh ấy trong và ngoài sân cỏ. Tôi sẵn sàng làm bất cứ điều gì cần thiết cho anh ấy, cho CLB và cho đồng đội"", Griezmann khẳng định.
Thanh Quý
(theo
Marca
)
Barca phải 'vay nóng' để mua Griezmann
Barca nợ một tỷ USD",https://vnexpress.net/griezmann-barca-nhu-co-ma-gian-lan-trong-tro-choi-dien-tu-3956185.html
20,"Thứ sáu, 3/5/2019, 11:06 (GMT+7)",Lính Libya dùng trò chơi điện tử để huấn luyện chiến đấu,Các tay súng trung thành với Chính phủ Đoàn kết dân tộc Libya (GNA) nói trò chơi giúp họ học chiến thuật và củng cố tinh thần.,"Lính Libya dùng trò chơi điện tử để huấn luyện chiến đấu
Nguyễn Tiến
(Theo
AFP
)",https://vnexpress.net/linh-libya-dung-tro-choi-dien-tu-de-huan-luyen-chien-dau-3917755.html
21,"Thứ năm, 14/3/2019, 14:36 (GMT+7)",Game thủ chế tạo thiết bị mang trò chơi điện tử đến với bệnh nhi,Mỗi năm thiết bị chơi game di động do Zach Wigal cùng bạn bè phát minh đem đến niềm vui cho hơn một triệu bệnh nhi khắp nước Mỹ.,"Có lúc, Zach Wigal trữ đến 5.000 thiết bị chơi game ở dưới căn hầm nhà bố mẹ. Thế nhưng, số thiết bị này không phục vụ riêng cho anh mà dành cho những em nhỏ mắc bệnh hiểm nghèo. Lập ra tổ chức phi lợi nhuận Gamers Outreach, mục đích của chàng trai 29 tuổi là mang niềm vui đến với bệnh nhi thông qua các trò chơi điện tử.
Wigal dùng game để giúp đỡ trẻ em trong bệnh viện. Ảnh:
Youtube.
Chia sẻ với
CNN
, Wigal cho biết anh đam mê game từ khi còn là học sinh cấp hai và thường xuyên tự tổ chức các giải đấu nhỏ. Bước ngoặt đến với Wigal khi giải đấu Halo 2 với 300 người tham gia do anh khởi xướng đột ngột bị cảnh sát hủy bỏ vì nghĩ rằng trò chơi ảnh hưởng xấu đến giới trẻ.
Để chứng tỏ cho nhà chức trách thấy các game thủ cũng có thể làm nên những điều tốt đẹp, năm 2008 Wigal và bạn bè đã tổ chức sự kiện Gamers for Giving, gây quỹ cho Hội Tự kỷ Mỹ.
Năm 2009, Wigal làm việc với Bệnh viện C.S Mott Children và cùng đồng nghiệp thiết kế GOKarts. Đây là máy chơi game di động trang bị màn hình lớn và cài sẵn game, có bánh xe di chuyển để dễ dàng đẩy vào phòng bệnh.
Bệnh nhi Mỹ chơi game bằng GOKarts. Ảnh:
Twitter.
""Chúng tôi nhận thấy bệnh viện có rất nhiều trò chơi điện tử nhưng chỉ để trong phòng chơi lớn. Vì lý do này, hầu hết bệnh nhi gặp khó khăn khi chơi. Phần lớn thời gian các em chỉ nằm trên giường bệnh"", Wigal nói.
Andrew Gabanyicz, kỹ thuật viên tại Bệnh viện C.S Mott Children ở Ann Arbor, Michigan, cho biết nhờ GOKarts, nhiều bé đã khỏe hơn, bớt lo lắng và giảm lượng thuốc giảm đau. Các bác sĩ cũng khuyến khích bệnh nhi dành thời gian nhất định để chơi điện tử.
Sau gần 10 năm phát triển, GOKarts đem lại niềm vui cho hơn một triệu bệnh nhi Mỹ trong thời gian điều trị căng thẳng và khó khăn. Tổ chức của Wigal cũng đặt thêm chi nhánh ở nhiều bệnh viện.
Phương Dung",https://vnexpress.net/game-thu-che-tao-thiet-bi-mang-tro-choi-dien-tu-den-voi-benh-nhi-3894430.html
22,"Thứ năm, 28/5/2015, 17:45 (GMT+7)",Học tiếng Anh qua trò chơi điện tử,"Đạt điểm 7.0 trong kỳ thi IELTS gần đây, Võ Phương Tú cho biết một phần vốn tiếng Anh của mình đến từ việc chơi điện tử.","Võ Phương Tú đang là sinh viên năm cuối chuyên ngành Tiếng Anh tại Đại học Công Nghệ TP HCM. Bạn đã đạt nhiều giải thưởng của trường, bao gồm giải nhất cuộc thi Hùng biện tiếng Anh năm 2014. Cũng trong năm đó, bạn đã thực hiện đề tài nghiên cứu mang tên: ""Sử dụng trò chơi điện tử làm động lực học tiếng Anh cho trẻ em"". Trong đợt thi IELTS mới đây, Tú đã đạt được số điểm 7.0. Tú đã viết một chia sẻ về kinh nghiệm học tiếng Anh thông qua trò chơi điện tử của mình.
Chơi game qua tiếng Anh là cách học lạ nhưng hiệu quả với một số người.
Từ một học sinh yếu tiếng Anh, tôi đã trở thành một sinh viên xuất sắc ngành Ngữ văn Anh tại trường đại học. Tất cả đều nhờ vào một quá trình lâu dài tiếp xúc với tiếng Anh.
Tiếng Anh đối với tôi là một ác mộng những năm trung học cơ sở. Khi ấy, mặc dù là học sinh giỏi nhưng hễ nói đến môn Anh văn thì tôi chỉ mong vượt qua điểm 6,5. Một trong những bước ngoặt lớn nhất của tôi là vào kỳ nghỉ hè để chuẩn bị bước vào năm lớp 9. Lúc đấy, tôi vẫn nhớ rõ mình quyết tâm học tiếng Anh. Lý do chỉ là để… chơi game một cách thoải mái, dễ chịu.
Thế rồi trong suốt mùa hè đó, tôi cố gắng sử dụng từ điển để tra tất cả những từ vựng học được trong game. Sau một tháng, tôi đã có thể dừng việc sử dụng từ điển, vì tôi nhận ra rằng cái tôi cần là nghĩa của từ, và đó chính là những hình ảnh trong game.
Khi vào lớp 9, tôi đã đạt được tiến bộ rõ rệt. Tôi tự tin trả lời các câu hỏi trong môn học mà tôi vốn kinh sợ. Những từ vựng, cấu trúc đều trở nên quen thuộc. Thậm chí, tôi còn chẳng nhớ các từ đấy mình đọc từ đâu.
Suốt năm lớp 9 và những năm cấp 3, tôi liên tục trau dồi vốn từ vựng nhờ vào những trò chơi điện tử. The Sims là một trong những trò yêu thích của tôi, và tôi học được vô vàn những danh từ diễn tả các vật dụng thông thường: Couch, bed, fence, cupboard…. Civilization 4 với hàng tá đoạn văn miêu tả những sự kiện lịch sử. Hay những trò chơi chiến thuật với những câu thoại lặp đi lặp lại liên tục: ""For the warchief"", ""Alright, bring it on""
Tất cả những từ ngữ, câu nói được lặp đi lặp lại liên tục, và tôi tiếp xúc với chúng hằng ngày, thậm chí còn nhiều hơn cả tiếng mẹ đẻ. Điều tôi thích nhất chính là nghĩa của từ đã được minh họa sẵn trong trò chơi, khiến tôi nhớ rất lâu. Dĩ nhiên, tất cả những trò mà tôi chơi đều là tiếng Anh. Mục tiêu chính của tôi khi chơi game vẫn là để học chứ không phải là đắm chìm vào trò chơi.
Thế rồi trong suốt cấp 3, với quá trình học-mà-chơi liên tục như vậy, tôi đã trở thành học sinh xuất sắc của lớp với điểm số ít khi nào dưới 8,5. Một thành tích như vậy cũng có một cái giá khá đắt, đó là tôi đã thụt lùi đối với các môn toán, lý, hóa mà mình vốn là học sinh giỏi năm nào.
Tuy vậy, với khả năng tiếng Anh đã thấm nhuần suốt nhiều năm ""cọ xát"", tôi đã có thể thi vào chuyên ngành tiếng Anh. Trong suốt 4 năm đại học, tôi liên tục tiếp thu những cấu trúc hay mà mình thấy trong game, thường lặp đi lặp lại những câu nói trong các trò chơi chiến thuật, chẳng hạn như: ""If a mouse farts in this mine field, it will blow us sky high"". Lúc rảnh, tôi sử dụng kiến thức đã học để phân tích những câu phức tạp như vậy.
Đến bây giờ, tôi tự hào là một người có thể giao tiếp lưu loát bằng tiếng Anh, nắm vững các cấu trúc và thậm chí là những tiếng từ lóng.
Xin nhắc lại với các bạn là tôi đã trải qua một quá trình tiếp xúc khá lâu dài để có thể đạt được thành công với ""công cuộc"" học tiếng Anh của mình. Điều tôi muốn chia sẻ với các bạn chính là cách học để bớt nhàm chán. Để học một ngôn ngữ, kiên trì vẫn là chủ yếu.
Trung tâm Anh ngữ AMA
Bí quyết học tiếng Anh của Á hậu Hoàng My",https://vnexpress.net/hoc-tieng-anh-qua-tro-choi-dien-tu-3225534.html
23,,Chim bắt chước tiếng trò chơi điện tử,"Chim giẻ cùi mào cong, chim thiên cầm có thể bắt chước tiếng kêu của các loài động vật khác hay phát ra âm thanh như tiếng trò chơi điện tử.",,https://video.vnexpress.net/khoa-hoc/chim-bat-chuoc-tieng-tro-choi-dien-tu-3203486.html
24,"Thứ hai, 20/4/2015, 15:54 (GMT+7)",Chim bắt chước tiếng trò chơi điện tử,"Chim giẻ cùi mào cong, chim thiên cầm có thể bắt chước tiếng kêu của các loài động vật khác hay phát ra âm thanh như trò chơi điện tử.","Chim có thể bắt chước tiếng trò chơi điện tử
Chim giẻ cùi mào cong (Cyanocorax cristatellus) có nguồn gốc từ Nam Mỹ, nổi bật với hai màu lông trắng và xanh. Chúng thường hình thành một nhóm gồm 12 cá thể, di chuyển cùng nhau để kiếm thức ăn và tránh kẻ săn mồi.
Lối sống cộng đồng là nguyên nhân hình thành khả năng phát ra nhiều âm thanh của loài chim này, giúp chúng cảnh báo kẻ thù và thu hút đối phương. Con chim có thể phát ra âm thanh như trò chơi điện tử.
Theo
Science Alert
, chim thiên cầm, loài chim bản địa ở Australia, cũng dễ dàng bắt chước tiếng của loài chim, động vật khác như gấu koala và cả tiếng xe, cộ, tiếng chớp máy ảnh. Khả năng này là do chim thiên cầm có minh quản (cơ quan tạo âm thanh của chim) phức tạp. Đặc điểm này giúp các cá thể trong loài phô diễn với bạn tình.
Dương Bùi
(Video:
You Tube
)
Những chiêu thu hút đối phương của động vật",https://vnexpress.net/chim-bat-chuoc-tieng-tro-choi-dien-tu-3203116.html
25,"Thứ ba, 29/3/2022, 12:17 (GMT+7)",VNG đầu tư vào công ty game Hàn Quốc,"VNG tham gia vòng gọi vốn series B của Haegin, một công ty game ""kỳ lân"" của Hàn Quốc.","Ở vòng gọi vốn series B, Haegin đã huy động được tới 100 tỷ KRW, tương đương 81 triệu USD, gia nhập hàng ngũ các công ty ""kỳ lân"" tại Hàn Quốc. VNG cho biết đã góp mặt trong vòng gọi vốn này cùng với các quỹ đầu tư khác của Hàn Quốc, không tiết lộ quy mô tham gia.
Đại diện VNG cho hay, thông qua việc rót vốn vào Haegin, VNG không chỉ mở rộng phạm vi kinh doanh trên thị trường quốc tế mà còn hướng tới trở thành một nhà đầu tư toàn cầu, đặc biệt là trong lĩnh vực metaverse.
Thành lập năm 2017, Haegin là công ty mobile game đầu tiên được giao dịch trên sàn KOSDAQ của Hàn Quốc. Công ty này ra mắt thị trường thế giới hàng loạt game đa thể loại như Home Run Clash, Overdogs, hay Play Together.
Trong đó, Play Together đã đạt 80 triệu lượt tải toàn cầu và 4 triệu người dùng hàng ngày (DAU) trong chưa đầy một năm phát hành. Trò chơi này còn thu hút sự quan tâm của thị trường metaverse toàn cầu khi Haegin ký hợp tác chiến lược với các đối tác như IPX, Genie Music, Daehong Planning, và Dot Mill.
Thuật ngữ metaverse được tác giả Neal Stephensen đề cập từ năm 1992 trong tiểu thuyết khoa học viễn tưởng
Snow Crash
. Nó mô tả một thế giới ảo nơi con người tương tác với nhau qua hình đại diện kỹ thuật số. Hiện vẫn chưa có khái niệm thống nhất về metaverse, nhưng các công ty công nghệ tin vũ trụ ảo không chỉ là nơi tái hiện sống động trải nghiệm đời thực trong môi trường số mà còn có thể tích hợp cả hai môi trường này với nhau.
Với VNG, theo báo cáo tài chính hợp nhất quý IV năm 2021, doanh thu trong ba tháng cuối năm của VNG tăng 17% so với cùng kỳ, lợi nhuận gộp đạt 776 tỷ đồng, tăng 24%. Tuy nhiên, các chi phí đều tăng mạnh khiến cho công ty lỗ ròng 283 tỷ đồng. Quý IV lỗ đậm kéo kết quả kinh doanh cả năm của VNG đi xuống, với lỗ ròng 71 tỷ đồng.
Theo
Bloomberg
, VNG đang cân nhắc việc niêm yết cổ phiếu tại Mỹ thông qua việc sáp nhập ngược với một công ty mua lại có mục đích đặc biệt (SPAC). Doanh nghiệp này đang làm việc với các cố vấn tài chính để tổ chức nhiều cuộc thảo luận với các SPAC cho một thỏa thuận trong tương lai. Nguồn tin riêng cho biết, giao dịch trên nếu diễn ra có thể định giá VNG ở mức 2-3 tỷ USD.
Minh Sơn",https://vnexpress.net/vng-dau-tu-vao-cong-ty-game-han-quoc-4444760.html
