No,Date,Title,Summary,Content,Link
1,"Thứ ba, 4/2/2025, 21:23 (GMT+7)",Mẹ kiện đòi 140 triệu đồng con trai nạp vào game online,"Trung QuốcTheo tòa, công ty game có lỗi khi thiếu biện pháp ngăn chặn người chơi không đúng độ tuổi, song mẹ cậu bé 11 tuổi cũng phải chịu trách nhiệm vì không quản lý con tốt.","Với sự phổ biến của Internet, ngày càng nhiều trò chơi điện tử có hình thức nạp tiền, trả thưởng để thu hút người chơi, đặc biệt vị thanh niên. Kéo theo đó, ngày càng nhiều vụ việc của phụ huynh kiện, yêu cầu đơn vị quản lý phát hành gema online trả lại số tiền con họ đã nạp vào các trò chơi trực tuyến này.
Cuối tháng 1 vừa qua
China Court
đưa tin, Tòa án nhân dân Bạch Thành, thành phố Cao Mật, tỉnh Sơn Đông vừa xét xử một vụ án như vậy.
Theo hồ sơ vụ kiện, từ 17/2-17/3/ 2024, Tiểu Lưu, 11 tuổi nhiều lần dùng máy tính bảng của mình để chơi trò chơi ""XX Escape"". Cậu vào cửa hàng game thông qua liên kết cửa hàng do bị đơn họ Khâu cung cấp trong phòng livestream (phát sóng trực tiếp) để nạp tiền và mua điểm, thiết bị liên quan trò chơi.
Nhiều trò chơi điện tử cho phép nạp tiền để mua đồ, tăng sức mạnh cho nhân vật, đặc biệt thu hút người chơi là trẻ vị thành niên. Ảnh:
Hải Thư
Tiểu Lưu sau đó sử dụng WeChat của mẹ để thanh toán và quét mã 22 lần để nạp tiền vào trò chơi, tổng cộng 41.130 nhân dân tệ (khoảng 145 triệu đồng).
Người mẹ biết chuyện đã kiện Khâu ra tại Tòa án nhân dân Bạch Thành, thành phố Cao Mật, tỉnh Sơn Đông, yêu cầu trả lại số tiền con trai đã nạp và tiền lãi.
Tại phiên tòa
, HĐXX phân tích, trong vụ kiện này, cần xác định tính hợp pháp của hành vi dân sự do người hạn chế năng lực hành vi dân sự thực hiện. Tiểu Lưu mới 11 tuổi nên được coi là người có năng lực hành vi dân sự hạn chế.
Các hành vi dân sự do người có năng lực hành vi dân sự hạn chế thực hiện, nếu phù hợp độ tuổi, trí tuệ và trạng thái tinh thần của họ thì được coi là hợp lệ; hoặc cần có sự đồng ý trước hoặc phê chuẩn sau đó bởi người đại diện hợp pháp của họ.
Trong vụ việc của Tiểu Lưu, hành vi pháp lý dân sự thực hiện (thanh toán 140 triệu đồng cho game online bằng tài khoản của mẹ) là không phù hợp với độ tuổi, trí tuệ và tình trạng tinh thần của cậu. Ngoài ra, theo tòa, cậu bé không có được sự đồng ý và sự phê chuẩn của người giám hộ (mẹ). Do đó, hành vi pháp lý dân sự phải vô hiệu.
Người nhận tiền, bị đơn Khâu, phải trả lại số tiền. Song tỷ lệ hoàn trả số tiền nạp phải được xác định dựa trên mức độ lỗi của cả hai bên.
Với tư cách là bị đơn, Khâu đã bán điểm trò chơi thông qua phòng phát sóng trực tiếp.
Mặc dù anh ta đã đánh dấu cửa hàng bằng cảnh báo: ""Không cho phép trẻ vị thành niên đặt hàng. Đơn hàng do trẻ vị thành niên đặt được coi là của người lớn và sẽ không được hoàn lại tiền"". Nhưng cảnh báo này có thể không hoàn toàn ngăn chặn trẻ vị thành niên đặt hàng.
Khi có đơn đặt hàng, công ty của Khâu đã không xác định và ngăn chặn trẻ vị thành niên sử dụng tài khoản WeChat của người giám hộ để thanh toán, không thực hiện các biện pháp hiệu quả để hạn chế trẻ vị thành niên nạp tiền liên tục, đó là một lỗi.
Ở phía ngược lại, mẹ của Tiểu Lưu không giữ đúng mật khẩu thanh toán điện thoại di động và WeChat, khiến Tiểu Lưu nạp tiền và tiêu tiền trong trò chơi thành công 22 lần. Người mẹ thiếu sự giáo dục và kỷ luật đối với con, đồng thời cũng có lỗi ở một mức độ nào đó. Do đó, theo tòa, mỗi bên có một nửa lỗi trong vụ việc này.
Xét đến tình tiết thực tế của vụ án và mức độ lỗi của cả hai bên, tòa án phán quyết bị cáo Khâu phải trả lại 50% số tiền.
Đôi bên đều chấp nhận phán quyết.
Bị đơn Khâu đã chủ động chấp hành việc trả lại tiền ngay sau khi bản án có hiệu lực.
Bản án còn nêu các nhà cung cấp dịch vụ trò chơi trực tuyến phải thiết lập các cơ chế liên quan để quản lý việc sử dụng của trẻ vị thành niên, thực hiện nghiêm ngặt hệ thống đăng ký tên thật cho tài khoản trò chơi trực tuyến, kiểm soát thời gian và thời lượng sử dụng trò chơi trực tuyến của trẻ vị thành niên và chuẩn hóa việc cung cấp các dịch vụ trả phí cho trẻ vị thành niên.
Ngoài ra, cha mẹ luôn là bên chịu trách nhiệm chính trong việc hướng dẫn trẻ em sử dụng Internet đúng cách. Họ phải thực hiện đầy đủ nghĩa vụ giám hộ của mình và lưu giữ đúng các thông tin như điện thoại di động, tài khoản thanh toán và mật khẩu.
Theo Điều 19, Bộ luật dân sự Trung Quốc, người chưa thành niên từ đủ 8 tuổi trở lên là người hạn chế năng lực hành vi dân sự. Việc thực hiện hành vi dân sự phải thông qua người đại diện theo pháp luật hoặc phải có sự đồng ý, xác nhận của người đại diện theo pháp luật.
Theo Điều 71 Luật về Bảo vệ Trẻ vị thành niên, cha mẹ hoặc người giám hộ khác của người chưa thành niên phải tăng cường hướng dẫn, giám sát việc sử dụng Internet của người chưa thành niên, sắp xếp thời gian sử dụng Internet hợp lý cho người chưa thành niên, phòng ngừa có hiệu quả tình trạng người chưa thành niên nghiện Internet.
Hải Thư
(Theo
ChinaCourt
)",https://vnexpress.net/me-kien-doi-140-trieu-dong-con-trai-nap-vao-game-online-4845788.html
2,"Thứ sáu, 28/2/2025, 14:10 (GMT+7)",Game bắn súng nhỏ nhất thế giới,Nhật BảnCác nhà khoa học kết hợp thế giới ảo với các hạt nano có kích thước chỉ một phần tỷ mét trong thế giới thực để tạo ra game bắn súng tương tác theo thời gian thực.,"Game bắn súng nhỏ nhất thế giới
Game bắn súng ứng dụng công nghệ Thực tế hỗn hợp nano (MR). Video:
Đại học Nagoya
Nhóm nghiên cứu do giáo sư Takayuki Hoshino tại Trường Kỹ thuật Sau đại học thuộc Đại học Nagoya tại Nhật Bản phát triển game bắn súng trong đó người chơi thao tác với các hạt nano có kích thước chỉ một phần tỷ mét,
Science Daily
hôm 26/2 đưa tin. Nghiên cứu mới, xuất bản trên tạp chí
Japanese Journal of Applied Physics
, là bước tiến quan trọng nhằm phát triển hệ thống giao diện máy tính tích hợp vật thể ảo với vật liệu nano thực.
Hoshino gọi trò chơi mới là ""game bắn súng nhỏ nhất thế giới"". Mục đích của nhóm nghiên cứu là tạo ra một phương pháp trực quan và hấp dẫn để giới thiệu công nghệ Thực tế hỗn hợp nano (MR), được thiết kế để hòa trộn thế giới thực với thế giới ảo, cho phép vật thể kỹ thuật số tương tác với môi trường vật lý.
MR kết hợp công nghệ kỹ thuật số với thế giới nano vật lý theo thời gian thực bằng cách sử dụng các chùm electron tốc độ cao. Chùm electron tạo ra những mẫu động của điện trường và hình ảnh quang học trên bề mặt hiển thị. Điều này cho phép nhóm nghiên cứu kiểm soát trường lực tác động lên các hạt nano theo thời gian thực, từ đó dịch chuyển và điều khiển chúng.
Trong trò chơi, người chơi dùng tay cầm để điều chỉnh mẫu quét của chùm electron. Thao tác này sẽ hiển thị trên màn hình dưới dạng chuyển động của một tàu vũ trụ ảo hình tam giác. Người chơi sau đó bắn địch thủ - thực chất là những quả cầu polystyrene kích thước nano - bằng chùm electron.
""Hệ thống chiếu tàu game lên không gian vật lý nano thực dưới dạng hình ảnh quang học và trường lực, tạo ra MR nơi các hạt nano và thành phần kỹ thuật số tương tác. Game là trò chơi bắn súng trong đó người chơi điều khiển tàu và bắn đạn vào các hạt nano thực để đẩy lùi chúng"", Hoshino giải thích.
Ngoài ứng dụng trong game, công nghệ mới còn giúp thao tác và lắp ráp các mẫu sinh học phân tử ở những cấp độ nhỏ nhất, mang đến tiềm năng ứng dụng trong công nghệ nano và kỹ thuật y sinh. ""Chúng tôi có thể in 3D các vật thể được tạo ra theo thời gian thực, cách mạng hóa lĩnh vực in 3D. Hoặc dùng kỹ thuật này để hướng tác nhân độc hại đến những tế bào virus trong sinh vật sống và tiêu diệt chúng"", Hoshino cho biết.
Thu Thảo
(Theo
Science Daily
)",https://vnexpress.net/game-ban-sung-nho-nhat-the-gioi-4854976.html
3,"Thứ hai, 20/3/2023, 09:37 (GMT+7)",Trò chơi điện tử có an toàn cho trẻ?,"Trò chơi điện tử có thể giúp trẻ cải thiện khả năng học tập, kỹ năng xã hội… nhưng nếu quá lạm dụng có thể gây ra một số tác hại.","Cả trẻ em và người lớn đều thích chơi trò chơi điện tử. Có nghiên cứu cho thấy chơi trò chơi điện tử mang lại một số lợi ích nhưng cũng có thể ảnh hưởng đến giấc ngủ ở trẻ, nghiện thiết bị điện tử, thậm chí có hành vi bạo lực. Điều quan trọng cha mẹ cần nhận biết những biểu hiện tiêu cực ở con để có phương pháp điều chỉnh phù hợp.
Trò chơi điện tử rất tốt trong việc giúp trẻ phát triển kỹ năng giải quyết vấn đề. Hoạt động giải trí này có thể củng cố các kỹ năng nhận thức và cải thiện khả năng suy nghĩ theo cách đa chiều của con.
Những trò chơi đơn giản có thể cải thiện tâm trạng của bé, tăng thư giãn và giảm bớt lo lắng. Trẻ cũng có thể xây dựng khả năng phục hồi cảm xúc bằng cách học cách đối phó với sự thắng thua trong các loại trò chơi điện tử.
Xã hội hóa là một lợi ích khác của trò chơi điện tử. Trong xu thế thời đại kỹ thuật số, đây là cách con có thể kết nối với bạn bè và giải tỏa căng thẳng. Thông qua hình thức chơi trực tuyến có thể kết nối con bạn với những đứa trẻ cùng tuổi có chung sở thích. Nói chung, trò chơi điện tử ở mức vừa phải là một cách an toàn để con học được nhiều kỹ năng và hành vi hữu ích.
Nếu con đang thể hiện hành vi đáng lo ngại, cha mẹ cần can thiệp. Những hành vi này có thể bao gồm sự cáu kỉnh khi không được chơi trò chơi yêu thích hoặc ngày càng tỏ ra hung hăng. Khi hành vi này xảy ra, cha mẹ vẫn có thể thực hiện các bước để điều chỉnh lượng phương tiện bạo lực tiếp nhận.
Trò chơi điện tử không phải là lý do duy nhất khiến trẻ trở nên hung hăng mà còn có các yếu tố khác. Trong số ít trường hợp, con có thể nghiện trò chơi điện tử và khiến chúng trở nên cáu kỉnh, gặp ảo giác, đau đớn về thể xác và có nguy cơ bị thừa cân. Nghiên cứu cho thấy những vấn đề này có thể được giải quyết bằng cách hạn chế hoặc tạm dừng chơi trò chơi điện tử.
Trò chơi điện tử mang đến một số lợi ích cho trẻ nếu chơi ở mức vừa phải và lựa chọn hình thức phù hợp. Ảnh:
Freepik
Cách giúp trẻ chơi điện tử an toàn
Một số nghiên cứu trước đây cho thấy sự nguy hiểm của trò chơi điện tử nhưng vẫn có nhiều cách để giúp phụ huynh bảo vệ con. Hãy giám sát con và hạn chế những trò chơi được cho là mang tới tác động xấu. Cha mẹ cũng cần nói chuyện với con về việc giữ an toàn trên mạng.
Có 3 điều cần theo dõi khi con chơi các trò chơi điện tử bạo lực bao gồm: tính cách lúc chơi, loại trò chơi và mục đích của chúng khi chơi. Những điều này góp một phần trong cách thức chúng phản ứng với bạo lực trên màn hình máy điện tử.
Một số mẹo có thể giúp bạn giám sát việc chơi trò chơi điện tử của con như:
Giới hạn thời gian chơi:
Nếu máy chơi ở trong phòng riêng, cha mẹ có thể không biết con dành bao nhiêu thời gian cho trò chơi. Học viện Nhi khoa Mỹ khuyến nghị, cha mẹ không nên để con chơi game nhiều hơn hai giờ mỗi ngày. Kiểm soát thiết bị điện tử của con ở một phòng khác có thể giúp bạn theo dõi thời gian chơi dễ dàng hơn.
Biết những gì con đang chơi:
Cập nhật thông tin về các trò chơi mà trẻ đang chơi để hạn chế các trò chơi điện tử có xu hướng bạo lực hoặc không phù hợp.
Theo dõi hành vi của con:
Nếu nhận thấy con mình có
dấu hiệu
như luôn mệt mỏi, cáu kỉnh hoặc học kém ở trường, phụ huynh nên nói chuyện với con về những tác hại của việc chơi game và lưu ý cận tiếp cận con với thái độ tử tế và ân cần.
Chơi cùng con:
Ngồi xuống và chơi với con bạn là một cách tuyệt vời để tăng sự gắn kết và cũng là cách để kiểm soát những gì con đang chơi. Hãy cố gắng hiểu trò chơi và những sở thích của con. Sau đó, các bé sẽ cởi mở hơn khi nói về những vấn đề mình gặp phải. Nếu con có biểu hiện thụ động hoặc hành vi thất thường, có lẽ đã đến lúc tạm dừng việc chơi điện tử ở con.
Một số loại trò chơi có thể giúp phát triển trí óc của bé và giúp chúng hòa nhập với xã hội như: trò chơi nhập vai, trò chơi trực tuyến nhiều người chơi, một số game bắn súng đơn giản, trò chơi chiến lược...
Bảo Bảo
(Theo
WebMD
)",https://vnexpress.net/tro-choi-dien-tu-co-an-toan-cho-tre-4583266.html
4,"Thứ năm, 28/11/2024, 14:57 (GMT+7)",Phần lớn game tại Việt Nam có nguồn gốc Trung Quốc,"Trò chơi điện tử có nguồn gốc Trung Quốc đang chiếm hơn 80% game được cấp phép, gấp 6 lần game tự phát triển trong nước.","Tại hội nghị tổng kết của Bộ Thông tin và Truyền thông sáng 28/11 ở Hà Nội, Cục Phát thanh truyền hình và Thông tin điện tử đánh giá ngành game đã tổ chức được một số sự kiện quy mô lớn, tăng trưởng nhân lực, nhưng đang tồn tại vấn đề khiến việc phát triển chưa tương xứng với tiềm năng.
Một trong số đó là trò chơi được cấp phép phát hành có nguồn gốc nước ngoài chiếm tỷ lệ lớn. Thống kê cho thấy game trong nước chỉ chiếm 14%, game từ Trung Quốc là 81%, trong khi 5% còn lại là từ các thị trường như Mỹ, Hàn Quốc, Nhật Bản.
""Các công ty game Việt Nam chủ yếu đóng vai trò nhà phát hành hơn là nhà sản xuất"", bà Nguyễn Thị Thanh Huyền, Phó Cục trưởng Phát thanh truyền hình và Thông tin điện tử, đánh giá. ""Trong khi năng lực sản xuất, tiềm năng phát triển game rất lớn, nên tỷ trọng đóng góp cho ngành game tại Việt Nam không tương xứng với doanh thu"". Ngoài ra, tình trạng tranh chấp, khiếu nại về bản quyền, hình ảnh, nội dung game thường xuyên xảy ra.
Bà Nguyễn Thị Thanh Huyền, Phó Cục trưởng Phát thanh truyền hình và Thông tin điện tử chia sẻ tại sự kiện sáng 28/11 ở Hà Nội. Ảnh:
Minh Sơn
Cục cho biết đã phối hợp với các bên rà quét, ngăn chặn 667 fanpage quảng cáo game cờ bạc, đổi thưởng trên Facebook, xử lý hơn 5.300 tên miền liên quan đến hoạt động quảng cáo, tổ chức đánh bạc và đánh bạc trên không gian mạng. Hơn 600 game không phép, cờ bạc trên các chợ ứng dụng nước ngoài được phát hiện và bị yêu cầu ngừng kết nối thanh toán. Theo đề nghị của Việt Nam, Apple đã gỡ 90 game, Google gỡ 294 game không phép, game cờ bạc phát hành xuyên biên giới vào Việt Nam.
Bên cạnh vấn đề tồn tại, ngành game được đánh giá đang phát triển mạnh mẽ. Theo Cục Phát thanh truyền hình và Thông tin điện tử, số lượng lao động ngành game năm 2024 ước khoảng 4.100 người, tăng 31% so với năm 2023. Tuy nhiên, doanh thu đạt khoảng 12.500 tỷ đồng, giảm nhẹ so với mức 12.552 tỷ đồng của năm ngoái.
Năm qua, các đơn vị trong nước cũng cùng xây dựng Chiến lược quản lý và phát triển ngành công nghiệp trò chơi điện tử trên mạng giai đoạn 2025-2030 và tổ chức thành công Triển lãm Game quốc tế -
Vietnam Gameverse 2024
.
Người dùng chơi
Mobile Legends Bang Bang
trên điện thoại
.
Ảnh:
Hoài Phương
Theo Thứ trưởng Phạm Đức Long, các con số trên cho thấy doanh nghiệp đã sát cánh với cơ quan quản lý cùng nhau thúc đẩy ngành game Việt phát triển vươn tầm thế giới. Tuy nhiên, tình trạng game lậu, xuyên biên giới vào Việt Nam ảnh hưởng đến sự phát triển lành mạnh của thị trường trong nước, tạo cạnh tranh bất bình đẳng.
""Trong năm 2025, các cơ quan quản lý có liên quan và doanh nghiệp game trong nước cần phối hợp rà quét và triệt để xử lý tình trạng game lậu, game bất hợp pháp"", Thứ trưởng Long nói.
Lưu Quý",https://vnexpress.net/phan-lon-game-tai-viet-nam-co-nguon-goc-trung-quoc-4821473.html
