No,Date,Title,Summary,Content,Link
39,"Thứ bảy, 11/5/2024, 19:04 (GMT+7)","VNGGames, Gamota đồng thắng giải Nhà phát hành game xuất sắc tại VGA 2024",TP HCMBất ngờ của Vietnam Game Awards 2024 nằm ở hạng mục Nhà phát hành game xuất sắc khi vinh danh hai đơn vị là VNGGames và Gamota.,"Giải thưởng Game Việt Nam - Vietnam Game Awards 2024 (VGA) là hoạt động quan trọng thuộc
Vietnam GameVerse
. Sự kiện do Cục Phát thanh, truyền hình và Thông tin điện tử - Bộ Thông tin và Truyền thông, Báo
VnExpress
, FPT Online và Liên minh Game Việt Nam phối hợp tổ chức.
Lễ trao giải Vietnam Game Awards 2024 bắt đầu từ 19h30 tại Nhà thi đấu Phú Thọ (TP HCM), thu hút đông đảo sự chú ý của cộng đồng yêu game. 300 ghế ngồi của sân khấu được chuẩn bị sẵn cho khách mời đã nhanh chóng được lấp đầy từ sớm. Không khí tại Vietnam Game Awards 2024 nóng dần theo từng phút khi những đề cử đầu tiên được công bố.
Khán giả lấp kín khán phòng Lễ trao giải Vietnam Game Awards 2024 trước khi sự kiện bắt đầu. Ảnh:
Bảo Lâm
Điểm mới của Vietnam Game Awards 2024
Năm nay Giải thưởng Game Việt Nam - Vietnam Game Awards 2024 có thêm nhiều hoạt động và điều chỉnh so với năm ngoái. Trong đó, giải thưởng tập trung vinh danh sản phẩm, dịch vụ, cộng đồng và cá nhân liên quan đến lĩnh vực game, có thành tích nổi bật thuộc 4 nhóm hạng mục: The Golden Galaxy (game được phát hành tại Việt Nam), The Golden Sun (game Việt), The Golden Star (thể thao điện tử) và The Golden Gear (dịch vụ, thiết bị liên quan tới game).
Năm nay, chương trình có riêng một nhóm hạng mục dành cho game Việt là The Golden Sun. Ngoài ra, Game Awards 2024 cũng có thêm một số giải thưởng mới như Nhà mạng được game thủ yêu thích nhất. Game và thiết bị được đề cử trong chương trình phải được phát hành từ năm 2023 trở đi, trừ hạng mục Game vượt thời gian và Game thể thao điện tử.
Khản giả hưởng ứng nồng nhiệt khi BTC công bố những con số ấn tượng như hơn 300 đề cử được gửi về, gần 800.000 lượt bình chọn chỉ trong vòng hai tháng bắt đầu bình chọn Vietnam Game Awards 2024.
Nhà phát hành game xuất sắc
Điều bất ngờ xảy ra ở hạng mục quan trọng nhất được trao tại VGA 2024 khi trên sân khấu xuất hiện hai chiếc cup danh giá. Hai đơn vị VNGGames và Gamota có số điểm tương đương, được tính 70% bởi đánh giá của ban giám khảo và 30% bình chọn từ độc giả, nên cùng nhận giải Nhà phát hành game xuất sắc 2024. .
Các đề cử tại vòng chung kết của hạng mục gồm VNGGames; Gamota; VTC; Gosu Online Corporation; và Funtap.
Ông Lê Quang Tự Do, Cục trưởng Phát thanh, truyền hình và thông tin điện tử - Bộ Thông tin và Truyền thông, trao giải Nhà phát hành game xuất sắc cho VNGGames và Gamota.
Giải thưởng Game của năm
Sân khấu Vietnam Game Awards 2024 như bùng nổ khi MC công bố danh sách đề cử trong hạng mục Game của năm gồm:
Đấu Trường Chân Lý, Revelation: Thiên Dụ, Alo Chủ Tướng, Battle Team 2 - Truy Kích PC, Con Đường Tơ Lụa - Silkroad Origin VTC
.
Đấu trường Chân Lý
được nhiều khách mời tại sự kiện nhận định xứng đáng nhận giải Game của năm tại VGA 2024.
Khi
Đấu Trường Chân Lý
được xướng tên trong hạng mục Game của năm, tiếng reo hò, vỗ tay vang dậy tại Nhà thi đấu Phú Thọ. Nhiều tín đồ của game đã ở lại đến muộn để chứng kiến thời khắc ban tổ chức Vietnam Game Awards 2024 vinh danh game xuất sắc trong năm. Trước đó, khán giả cũng hô to khi game này được đọc tên trong các đề cử
Đấu trường Chân Lý
mobile là phiên bản di động của game
Đấu Trường Chân Lý (TFT),
ra mắt người chơi Việt Nam cuối tháng 11/2023 và tạo nên ""cơn sốt"" trong cộng đồng game thủ. Game nhanh chóng đạt Top 1 lượt tải về trên cả App Store và Google Play chỉ vài tiếng sau khi phát hành, trên một triệu lượt tải chỉ sau ba ngày ra mắt.
Game di động xuất sắc thuộc về
Football Pro VTC.
Giải thưởng The Golden Galaxy
Football Pro VTC
vượt qua các đối thủ sừng sỏ để thắng trong hạng mục Game di động xuất sắc. Game thể thao này cũng giành thêm giải thưởng quan trọng khác là Cộng đồng game được yêu thích nhất. Trong khi đó, giải thưởng Game vượt thời gian xướng tên
Liên quân Mobile
trong sự heo rò của khán giả có mặt tại sự kiện.
Giải thưởng The Golden Sun
Nhóm giải thưởng The Golden Sun vinh danh và khuyến khích sản phẩm game của người Việt với sáu giải.
God Of Weapons
thắng hai hạng mục Game Việt có gameplay hay nhất và Game indie Việt xuất sắc.
Trong khi đó, với thiết kế đồ họa đơn giản nhưng trực quan và mang hơi hướng phong cách anime,
Sky Dancer 2
giành chiến thắng ở hạng mục Game Việt có thiết kế đồ họa xuất sắc.
Đại diện
Sky Dancer 2
nhận giải Game Việt có thiết kế đồ họa xuất sắc.
WOWS - Làng Hiệp Sĩ
thắng lớn tại Vietnam Game Awards 2024 với ba giải thưởng: Game Việt có cốt truyện hay nhất, Game di động Việt xuất sắc và Game Việt của năm.
Giải thưởng The Goden Star
The Golden Star là hạng mục dành riêng cho Thể thao điện tử với bốn giải thưởng. Năm nay, hạng mục Game thể thao điện tử xuất sắc gọi tên
Liên Quân Mobile
.
Battle Teams 2 - Truy Kích PC
giành giải Cộng đồng thể thao điện tử được yêu thích nhất. Đội tuyển thể thao điện tử xuất sắc tại Vietnam Game Awards 2024 là Saigon Phantom.
Đại diện Battle Teams 2 - Truy Kích PC nhận giải Cộng đồng thể thao điện tử được yêu thích nhất.
Khi các đề cửa của hạng mục Vận động viên thể thao điện tử xuất sắc được chiếu lên màn hình, phần lớn khán giả tại sự kiện đồng loạt hô vang tên Thóng Lai Bâng. Đây là năm thứ hai liên tiếp, game thủ sinh năm 2001 được vinh danh tại Vietnam Game Awards.
Giải thưởng The Golden Gear
Asus lập cú đúp khi được vinh danh tại hai hạng mục Điện thoại chơi game xuất sắc với ROG Phone 8 và Laptop chơi game xuất sắc với ROG Strix SCAR 18 (2024).
LG UltraGear OLED cong 800R 45 inch thắng giải Màn hình gaming xuất sắc. Trong khi đó, Tai nghe chơi game xuất sắc thuộc về Logitech G PRO X 2 Lightspeed Wireless.
Đại diện LG nhận giải màn hình gaming xuất sắc.
VNPT thắng giải Nhà mạng được yêu thích nhất trong sự bất ngờ của nhiều khán giả có mặt tại Giải thưởng Game Việt Nam 2024. Còn MoMo hai năm liên tiếp giành được giải Kênh thanh toán được yêu thích nhất. Trong khi đó, Sting vượt qua Monster để trở thành Đồ uống game thủ yêu thích nhất năm nay.
Hiếu Thứ Hai, Bích Phương khuấy đảo sân khấu Vietnam Game Awards 2024
Ngoài những màn rượt đuổi gay cấn trong từng hạng mục giải thưởng, sân khấu Vietnam Game Awards 2024 liên tục ""bùng cháy"" với sự xuất hiện của ca sĩ Bích Phương và Hiếu Thứ Hai. Cả hai cùng nhận mình là game thủ và bày tỏ niềm vui khi được góp mặt tại Ngày hội Game Việt Nam.
Khán giả liên tục reo hò tên ca sĩ và những ca khúc hit như
Đi đu đưa đi,
Ngủ Một Mình...
Bích Phương có màn giao lưu hóm hỉnh cùng khán giả tại đêm trao giải. Khi được MC hỏi có có còn ""cày game"" không, nữ ca sĩ nói: ""Bích Phương vẫn chăm chỉ leo rank như công nhân, không có thành tích vẫn leo"". Hàng trăm cánh tay giơ lên khi được hỏi ""ai muốn 'gánh' Bích Phương?"".
Hiếu Thứ Hai, Bích Phương khuấy đảo sân khấu Vietnam Game Awards 2024.
Trong khi đó Hiếu Thứ Hai liên tục tạo sự bùng nổ với những màn vũ đạo bốc lửa. Những tràng vỗ tay, reo hò kéo dài liên tục vang lên khắp nhà thi đấu Phú Thọ khi ca sĩ trình diễn bài hit
Ngủ Một Mình.
Ban tổ chức cũng trao phần thưởng cho độc giả may mắn khi tham gia bình chọn cho 22 giải thưởng tại Vietnam Game Awards năm 2024 là iPhone 15 Pro Max 256 GB trị giá hơn 30 triệu đồng. Mã số trúng thưởng là 363090.
Tuấn Hưng - Khương Nha - Lưu Quý
Ảnh:
Quỳnh Trần
Xem diễn biến chính",https://vnexpress.net/le-trao-giai-vietnam-game-awards-2024-4744919-tong-thuat.html
40,"Thứ hai, 3/4/2023, 13:00 (GMT+7)",VTC Mobile là Nhà phát hành game xuất sắc 2023,"TP HCMVTC Mobile nhận số điểm cao nhất tại hạng mục The Golden Sun cho nhà phát hành, thuộc khuôn khổ Vietnam GameVerse 2023, trao giải tối 1/4.","Đơn vị đạt tổng điểm 8,59 từ Ban giám khảo và lượt bình chọn, bằng với số điểm của VNG. Đây là hạng mục duy nhất có hai đơn vị bằng điểm, cùng nhận giải Nhà phát hành game xuất sắc.
Năm 2022, VTC Mobile cho ra đời 10 sản phẩm. Trong đó có những tựa game gây tiếng vang như
Giang Hồ Ngũ Tuyệt, Au Top, Đạo Sĩ Xuất Quan, Tây Hành Kỷ
... Cùng với đó là các chiến dịch truyền thông lớn thu hút hàng trăm triệu lượt xem, tạo chú ý trên khắp nhiều nền tảng mạng xã hội tại Việt Nam.
Ngoài giải thưởng này, VTC Mobile còn vào Top 5 đề cử Game của năm với game
Ta là đạo sĩ xuất quan
và Top 5 Cộng đồng game được yêu thích nhất với
Đại Chiến Tam Quốc
.
Ông Nguyễn Viết Quang Minh - CEO VTC Mobile (trái) nhận giải Nhà phát hành xuất sắc. Ảnh:
Quỳnh Trần
Theo đại diện VTC Mobile, nhà phát hành có vai trò quan trọng trong việc phát triển ngành game. Đây là cầu nối giúp đơn vị sản xuất đưa sản phẩm tiếp cận người chơi và tạo nên một cộng đồng lớn mạnh, bền vững.
""Giải thưởng Nhà phát hành game xuất sắc thể hiện sự vinh danh cho những nỗ lực phát triển, thay đổi bộ mặt thị trường game tại Việt Nam. Danh hiệu này cũng giúp VTC Mobile khẳng định vị trí dẫn đầu trong ngành game Việt, tạo cột mốc đáng nhớ với chúng tôi"", đại diện đơn vị nói.
Trước hoạt động vinh danh, sáng ngày 1/4, Diễn đàn Game được tổ chức, bàn thảo về tiềm năng, tương lai ngành game.
Bao quanh sự kiện là không gian trưng bày Game Expo gồm 17 gian hàng, thu hút hơn 10.000 game thủ, người yêu game, chuyên gia trong ngành... đến trải nghiệm. Gian hàng của VTC Mobile có đa dạng hoạt động, là một trong những điểm hút khách nhất tại ngày hội. Tại đây, game thủ có thể chơi các dòng game đình đám đến từ nhà phát hành VTC Mobile và nhận hàng nghìn vật phẩm gồm áo, mũ, sổ tay, đèn, gấu bông...
Dàn cosplay các nhân vật game của VTC Mobile thu hút đông đảo sự quan tâm của cộng đồng game thủ. Ảnh:
VTC
VTC Mobile là đơn vị thành viên của Tổng công ty truyền thông đa phương tiện VTC. Công ty có 13 năm kinh nghiệm, đạt nhiều thành công trong lĩnh vực phát hành game tại thị trường Việt Nam cũng như Đông Nam Á. Trong toàn ngành, VNG và VTC Mobile luôn giữ vị trí dẫn đầu, bắt kịp các xu hướng game hiện đại, đáp ứng tốt thị hiếu của người chơi.
Minh Tú
Độc giả xem thêm tại
website
hoặc
Fanpage",https://vnexpress.net/vtc-mobile-la-nha-phat-hanh-game-xuat-sac-2023-4588464.html
41,"Thứ ba, 21/3/2023, 15:00 (GMT+7)",5 nhà phát hành game hàng đầu thế giới,"Microsoft, Tencent, Sony, Nintendo và Netease đang là những công ty có doanh thu dẫn đầu thị trường game quốc tế, theo Yahoo Finance.","Những nhà phát hành này đều sở hữu các tựa game nổi tiếng, gắn liền với lịch sử hình thành của doanh nghiệp. Cuối năm 2022, dựa trên doanh thu thường niên năm 2021, Yahoo Finance công bố danh sách 20 công ty game lớn nhất thế giới. Trong đó, 5 công ty trên đều là những cái tên dẫn đầu của ngành với doanh thu đều vượt mốc 13 tỷ USD.
Microsoft Corporation
Dẫn đầu danh sách với doanh thu 2021 lên đến 168,08 tỷ USD là tập đoàn công nghệ hàng đầu thế giới Microsoft, có trụ sở tại Redmond, Washington (Mỹ). Ngoài chuyên sản xuất phần mềm máy tính, điện tử tiêu dùng và máy tính cá nhân, ""ông lớn"" giới công nghệ còn sở hữu một trong những dòng máy chơi game nổi tiếng - Xbox. Đây cũng là sản phẩm chủ lực của hãng.
Công ty con Xbox Game Studios trực thuộc tập đoàn là đơn vị chuyên sản xuất và phát hành trò chơi điện tử riêng cho dòng máy console này. Ngoài ra còn có những tựa game đa nền tảng dành cho máy tính Windows và điện thoại di động Windows.
Xbox Series S là một trong những dòng máy game console có thiết kế nhỏ gọn, được Microsoft cho ra mắt năm 2020. Ảnh:
Microsoft
Tencent Holdings Limited
Giữ vị trí Á quân là tập đàon công nghệ - giải trí hàng đầu Trung Quốc Tencent Holdings Limite. Đây là một trong những doanh nghiệp đa phương tiện dẫn đầu thế giới về doanh thu. Tencent Games là một nhánh nhỏ của tập đoàn, tập trung phát triển và xuất bản trò chơi điện tử đa thể loại và nền tảng.
PUBG Mobile
và
Metal Slug: Awakening
là hai trong số những game nổi tiếng do công ty này phát triển. Năm 2021, doanh thu của Tencent Holdings Limited chạm mốc 86,61 tỷ USD. Trong đó,
PUBG
đóng góp lượng lớn doanh thu không chỉ từ lượng người chơi đông đảo, mà còn bao gồm cả doanh thu từ các giải đấu, livestream, thương mại, truyền thông, quảng bá... và nhiều lĩnh vực liên quan khác.
Sony
Xếp sau hai ""ông lớn"" từ Mỹ và Trung Quốc là Sony - tập đoàn đa quốc gia có trụ sở tại Tokyo, Nhật Bản. Ngoài là một trong những nhà sản xuất hàng đầu trong lĩnh vực điện tử tiêu dùng và chuyên nghiệp, Sony còn sở hữu dòng máy chơi game console đình đám, không kém cạnh Xbox là PlayStation.
Các sản phẩm liên quan đến lĩnh vực trò chơi điện tử và giải trí kỹ thuật số của Sony đều phát hành thông qua Sony Interactive Entertainment. Công ty này chia thành gồm hai bộ phận gồm Sony Interactive Entertainment LLC (có trụ sở tại California, Mỹ) và Sony Interactive Entertainment Inc. (có trụ sở tại Tokyo, Nhật Bản).
Tính đến tháng 6/2022, Sony đã bán ra hơn 581 triệu máy PlayStation. Năm 2021, công ty này báo cáo doanh thu chạm mốc 84,59 tỷ USD, trở thành nhà phát hành game lớn thứ 3 toàn cầu, sau Tencent và Microsoft.
Xbox, Switch và PlayStation hiện là ba trong số các loại máy gaming console được ưa chuộng trên thế giới với tổng số lượng máy bán ra lên đến hàng trăm triệu. Ảnh:
Amazon
Nintendo
Kế tiếp là ""ứng viên"" sở hữu nhiều công ty con chuyên phát triển, sản xuất và bán các sản phẩm liên quan tới giải trí công nghệ, kỹ thuật số - Nintendo. Doanh nghiệp này sở hữu nhiều sản phẩm thành công, nổi bật trong ngành công nghiệp trò chơi điện tử trong từng giai đoạn khác nhau, như Super Nintendo Entertainment System, Game Boy, Nintendo DS, Wii và Switch.
Hoạt động kinh doanh của Nintendo đến nay đã bao phủ gần như toàn cầu với những thị trường trọng điểm như châu Âu, Bắc Mỹ, Nam Mỹ, châu Á và các quốc gia khác. Doanh thu của công ty trong năm 2021 là 15,88 tỷ USD.
NetEase
Bằng chứng cho thấy sự vươn lên mạnh mẽ của ngành game tại châu Á là có đến hai ứng viên cả Trung Quốc vào top 5 nhà phát hành lớn nhất năm 2023. Tuy xếp sau 3 ""ông lớn"" Âu - Mỹ kể trên và người ""đồng hương"" Tencent, song NetEase vẫn gây ấn tượng khi dừng ở vị trí top 5 với doanh thu game năm 2021 là 13,74 tỷ USD.
Đây vốn là một doanh nghiệp công nghệ Internet chuyên cung cấp các dịch vụ cộng đồng, thương mại, truyền thông và nội dung trực tuyến. Ngoài ra, công ty còn mở rộng cung cấp các game mobile, PC-client, thương mại điện tử, e-mail, quảng cáo, video - âm nhạc trực tuyến, livestream và các dịch vụ thanh toán trực tuyến khác.
NetEase và Tencent hiện là hai công ty game lớn dẫn đầu thị trường Trung Quốc và lọt top 5 nhà phát hành có doanh thu hàng đầu năm 2021. Ảnh:
AFP
NetEase được các game thủ đánh giá mang lại trải nghiệm chơi trò chơi đặc biệt, truyền cảm hứng cho người chơi. Ngoài ra, các game do đơn vị này sản xuất còn góp phần mang lại nhiều giá trị cho cộng đồng game toàn cầu thông qua các tài nguyên R&D (nghiên cứu và phát triển) hàng đầu sẵn có được lưu hành nội bộ.
Ngoài 5 ông lớn dẫn đầu ngành trò chơi điện tử thế giới kể trên, danh sách còn có những cái tên đình đám khác, giữ vị trí top 6 đến 20 như: Sea Limited doanh thu 9,95 tỷ USD; Activision Blizzard 8,8 tỷ USD; Bandai Namco Holdings 7,36 tỷ USD; GameStop Corp. 6,01 tỷ USD; Epic Games 5,75 tỷ USD...
Thy An
(Theo
Yahoo Finance, Insider Monkey
)
""Nhà phát hành game xuất sắc"" là một trong các hạng mục đề cử thuộc Giải thưởng Game Việt Nam - Vietnam Game Awards, do Cục Phát thanh, truyền hình và thông tin điện tử - Bộ Thông tin và Truyền thông,
Báo VnExpress
và Liên minh Game Việt Nam phối hợp tổ chức.
Giải thưởng nằm trong chuỗi hoạt động thuộc khuôn khổ Ngày hội Game Việt Nam -
Vietnam GameVerse 2023
. Từ tháng 2 đến tháng 4, ngày hội tổ chức các Game Talks, đấu trường Game Arena, không gian trưng bày Game Workshop và Diễn đàn về xu hướng ngành game Việt.
Sự kiện Vietnam GameVerse 2023 sẽ được tổ chức ngày 1-2/4 tại TP HCM.
Đăng ký tham gia
tại đây",https://vnexpress.net/5-nha-phat-hanh-game-hang-dau-the-gioi-4583242.html
42,"Thứ sáu, 17/12/2021, 17:30 (GMT+7)",Nhà phát hành game Võ Lâm Truyền Kỳ chung tay chống dịch,"Máy thở, máy tính xách tay, các túi thuốc an sinh… được nhà phát hành Võ Lâm Truyền Kỳ trao đến người dân tại nhiều tỉnh thành trên toàn quốc.","Theo đó, nhà phát hành Võ Lâm Truyền Kỳ đã phối hợp với VinaCapital Foundation và Joy Foundation, trao tặng 1 máy thở cho bệnh viện Nguyễn Trãi, TP HCM, 35 máy tính xách tay cho học sinh bị bệnh tim, gia đình khó khăn bị ảnh hưởng bởi Covid-19.
Đại diện Nhà phát hành Võ Lâm Truyền Kỳ (bên trái) và đại diện VinaCapital Foundation trước khi trao tặng máy thở tại bệnh viện Nguyễn Trãi, TP HCM. Ảnh:
Nhà phát hành VLTK.
Các tỉnh thành phố được đơn vị này lựa chọn triển khai chương trình có: TP HCM, Đà Nẵng, Huế, Lâm Đồng, Tiền Giang, Đồng Tháp, An Giang, Bạc Liêu và Sóc Trăng.
Các tặng phẩm khác còn có 24.000 khẩu trang, 6.500 bộ đồ bảo hộ, 19 máy bơm tiêm điện, 1 máy siêu âm, 6 máy đo đường huyết, 9 máy tạo oxy, 50 máy SPO2... được trao đến các cơ sở y tế, cùng 10.000 túi thuốc an sinh cho các bệnh nhân F0. Tổng giá trị các thiết bị trên tương đương 1,6 tỷ đồng, được trao tặng vào đầu tháng 12.
Đại diện Nhà phát hành Võ Lâm Truyền Kỳ và VinaCapital Foundation trao tặng máy tính xách tay cho trẻ có hoàn cảnh khó khăn tại Đà Nẵng. Ảnh:
Nhà phát hành VLTK.
Chương trình ""Võ Lâm Truyền Lửa – cùng vượt đại dịch"" được diễn ra từ 15/11 đến 28/11, trên hệ thống các fanpage của dòng game Võ Lâm Truyền Kỳ. Sau hai tuần triển khai, chương trình đã ghi nhận số tiền là 1,6 tỷ đồng.
Đại diện Nhà phát hành Võ Lâm Truyền Kỳ trao tặng phẩm tại tỉnh An Giang. Ảnh:
Nhà phát hành VLTK.
Võ Lâm Truyền Kỳ là dòng game trải qua hơn 16 năm vận hành, kỳ vọng tạo ra sân chơi giải trí lành mạnh, thu hút đông đảo cộng đồng game thủ toàn quốc.
Tuấn Vũ",https://vnexpress.net/nha-phat-hanh-game-vo-lam-truyen-ky-chung-tay-chong-dich-4404693.html
43,"Thứ bảy, 22/3/2025, 14:00 (GMT+7)",VNGGames sắp phát hành Lineage2M tại Việt Nam,Game nhập vai Lineage2M đến từ ông lớn NCSoft sẽ được VNGGames phát hành tại Đông Nam Á trong đó có Việt Nam trong thời gian tới.,"Ngày 20/3, VNGGames cung cấp một số thông tin đầu tiên về việc phát hành trò chơi mới. Sản phẩm dự kiến đến tay game thủ Việt trong tháng 5 sắp tới. Đi kèm với việc phát hành là những sự kiện chào mừng với hàng loạt quà tặng.
Đây là một phần trong hoạt động của liên doanh NCV Games được VNGGames và công ty game hàng đầu Hàn Quốc là NCSoft ký kết thành lập vào tháng 8/2024.
Lineage2M
sẽ là sản phẩm đầu tiên được phát hành dưới danh nghĩa liên doanh này tại toàn bộ thị trường Đông Nam Á.
VNGGames và NCSoft ký kết hợp tác. Ảnh:
VNGGames
Đối với việc phát hành tại thị trường Đông Nam Á, đơn vị cho biết sẽ có một buổi họp báo công bố tổ chức tại Thái Lan vào ngày 29/3.
Lineage2M
là sản phẩm đại diện mới nhất của ""thương hiệu tỷ USD"" Lineage đến từ tập đoàn NCSoft. Đây là thương hiệu sản phẩm quan trọng đóng góp một phần doanh thu lớn trong kết quả kinh doanh hàng năm của đơn vị này.
Sản phẩm được đầu tư rất lớn và gây được tiếng vang khi được phát hành lần đầu tiên tại thị trường Hàn Quốc. Game đã đứng đầu bảng xếp hạng game di động ăn khách nhất thị trường Hàn Quốc suốt hai tháng sau đó.
Trò chơi có nhiều ưu điểm như kế thừa phong cách nhập vai (MMORPG) với kinh nghiệm hơn 20 năm của thương hiệu Lineage nổi bật với những trận chiến PvP quy mô lớn từ liên server đến liên thế giới (World vs World). Chế độ linh động hơn 100 thẻ chức năng giúp người chơi xây dựng nhân vật theo cá tính riêng. Đồ họa 3D từ Unreal Engine 4, độ phân giải lên đến 4K UHD cùng sự hỗ trợ của Purple Launcher do chính NCSoft phát triển giúp chơi game song hành ngay cả trên PC.
NCSoft được biết đến là tập đoàn phát triển và phát hành game hàng đầu tại Hàn Quốc với các trò chơi như
Lineage, AION, Blade & Soul, Guild Wars
. Thành lập từ năm 1997, hệ sinh thái trò chơi của hãng hiện phục vụ hàng trăm triệu người dùng ở 60 quốc gia trên toàn thế giới.
VNGGames là nhà phát hành game hàng đầu tại Việt Nam và khu vực, với danh mục sản phẩm hơn 130, ghi nhận 78,7 triệu người dùng hằng quý (QAU) trong năm 2023. Từ năm 2005 đến nay, đơn vị đã phát hành thành công hơn 200 game ở Việt Nam, trong đó có những trò chơi nổi tiếng như
Võ Lâm Truyền Kỳ, PUBG Mobile, Valorant, Play Together;
hơn 40 game ở thị trường quốc tế, đồng thời phát triển hơn 20 tựa game chất lượng cao cho thị trường toàn cầu.
Liên tiếp trong hai năm (2023-2024), đơn vị được vinh danh ""Nhà phát hành game xuất sắc nhất"" tại Giải thưởng Game Việt Nam do Cục Phát thanh, Truyền hình và Thông tin điện tử, Báo
VnExpress
phối hợp tổ chức. Ở thị trường quốc tế, nhà phát hành được ghi nhận tích cực với hàng loạt giải thưởng và xếp hạng uy tín từ các tổ chức như MMA Global, AppsFlyer, Data.ai... đơn vị có văn phòng tại nhiều thành phố lớn trên toàn châu Á như Thượng Hải, Quảng Châu, Đài Bắc, Bangkok, Jakarta, Kuala Lumpur...
Hoài Phương",https://vnexpress.net/vnggames-sap-phat-hanh-lineage2m-tai-viet-nam-4864273.html
