No,Date,Title,Summary,Content,Link
49,"Thứ hai, 17/3/2025, 15:00 (GMT+7)",Vietnam Game Awards 2025 thêm hai giải thưởng cho game Việt,Hai hạng mục giải thưởng gồm Game Việt thành công toàn cầu và Nhà phát triển game Việt xuất sắc được bổ sung trong Vietnam Game Awards 2025.,"Hai nội dung mới nâng tổng số lượng giải thưởng của Vietnam Game Awards 2025 lên 23. Trong số hơn 300 hồ sơ, số lượng game nước ngoài được phát hành ở Việt Nam vẫn áp đảo. Tuy nhiên, đề cử liên quan tới game Việt cũng tăng vọt so với năm ngoái cả về số lượng và thể loại. Do đó, ban tổ chức đã quyết định tăng thêm hai giải thưởng
Game Việt thành công toàn cầu
và
Nhà phát triển game Việt xuất sắc
để ghi nhận và vinh danh sản phẩm Việt, từ đó góp phần thúc đẩy thị trường trong nước phát triển.
Theo đánh giá, game Việt đang có mức độ trưởng thành nhanh. Năm qua, nhiều sản phẩm mạnh dạn tiến ra thị trường nước ngoài, đạt được thành công với hàng trăm triệu lượt tải, hình thành cộng đồng người chơi thường xuyên. Thị trường quốc tế không chỉ là thước đo chất lượng mà còn đóng góp lớn cho doanh thu của nhà phát triển. Các studio trong nước hiện có đội ngũ chất lượng cao cùng khả năng gia công sản phẩm tiệm cận quốc tế cả về đồ họa, gameplay, cốt truyện. Dù vẫn chiếm thiểu số, tỷ lệ game Việt trên toàn thị trường đang nhích lên đều đặn, từ 12% năm 2022 lên 14% năm 2024.
Một studio sản xuất game Việt. Ảnh:
Quỳnh Trần
Do bổ sung giải thưởng mới, Vietnam Game Awards 2025 thay đổi thời gian mở cổng bình chọn vòng Sơ loại từ ngày 17/3 sang 20/3. Ở vòng này, top 5 của mỗi hạng mục giải thưởng vào vòng Chung kết sẽ dựa trên 50% điểm số của hội đồng chuyên môn và 50% bình chọn từ cộng đồng.
Riêng các hạng mục ""được yêu thích nhất"" sẽ phụ thuộc hoàn toàn từ lượng vote.
Kết quả chung cuộc được công bố tại lễ trao giải diễn ra trong khuôn khổ sự kiện Vietnam GameVerse ngày 24-25/5 tại SECC, quận 7, TP HCM.
Ngoài Vietnam Game Awards, ngày hội năm nay còn nhiều hoạt động khác xoay quanh ngành game. Trong đó, Diễn đàn Game Việt Nam 2025 là không gian dành cho đại diện đơn vị, doanh nghiệp và chuyên gia thảo luận về những chủ đề hấp dẫn đang được quan tâm của lĩnh vực game. Hoạt động hợp tác, đầu tư sẽ kết nối, hỗ trợ các đơn vị giới thiệu sản phẩm, tìm kiếm và kết nối đối tác trong lẫn ngoài nước. Chuỗi hoạt động giải trí bao gồm triển lãm game, sản phẩm, dịch vụ trong ngành, đấu trường trực tuyến, cuộc thi cosplay.
Vietnam GameVerse
được tổ chức từ năm 2023, trở thành dấu mốc đáng nhớ khi lần đầu tiên một sự kiện quy mô lớn quy tụ đông đảo nhà phát hành, đơn vị sản xuất, đầu tư và cộng đồng yêu game tại Việt Nam. Sau hai năm tổ chức, Vietnam GameVerse trở lại với diện mạo mới.
Địa điểm tổ chức mới - SECC giúp nâng cấp không gian, tăng quy mô với kỳ vọng hút khoảng 50.000 người tham gia. Sự kiện do Cục Phát thanh, Truyền hình và Thông tin điện tử, Báo
VnExpress
và Công ty FPT Online đồng tổ chức. Ban tổ chức mong muốn sự kiện tạo ra những tác động tích cực tới sự phát triển của ngành công nghiệp game Việt Nam, đồng thời nhận sự quan tâm ủng hộ, hưởng ứng của cơ quan quản lý, các chuyên gia trong lĩnh vực.
Hoài Phương",https://vnexpress.net/vietnam-game-awards-2025-them-hai-giai-thuong-cho-game-viet-4862287.html
50,"Thứ năm, 20/3/2025, 14:46 (GMT+7)",Thiết kế game giúp nam sinh thành á khoa đồ án tốt nghiệp,"Giao diện game ""Marmoris - Ẩn tích còn sót lại"" về nền văn hóa Đại Việt giúp Nhật Khang trở thành á khoa đồ án tốt nghiệp ngành Thiết kế đồ họa, Đại học Văn Lang.","Đồ án của Huỳnh Nhật Khang, sinh viên năm cuối, gồm nhiều hạng mục như tên game, nhân vật, bản đồ, giao diện và trải nghiệm với người dùng (UI/UX), hệ thống quảng bá trò chơi.
Đạt điểm 9.3/10, thiết kế giao diện game giúp Khang trở thành á khoa trong đợt bảo vệ hồi tháng 1 với khoảng 200 đồ án.
Mô phỏng game ""Marmoris - Ẩn tích còn sót lại""
Bản mô phỏng game ""Marmoris - Ẩn tích còn sót lại"" của Huỳnh Nhật Khang. Video:
Nhân vật cung cấp
Khang kể năm 2023 được đi thực tế môn Nghiên cứu vốn cổ dân tộc tại Huế. Lần đầu tiếp xúc kiến trúc đình đài, lầu các ở cố đô, nam sinh choáng ngợp trước những chi tiết, hoa văn truyền thống. Từ đó, Khang chọn lối thiết kế mang dấu ấn văn hóa cổ xưa.
Mong muốn tác phẩm có tính nhận diện cao, Khang chọn làm game để dễ tiếp cận giới trẻ. Qua tìm hiểu, nam sinh được tiếp thêm động lực khi một số tựa game về văn hóa được người chơi ủng hộ như ""Black Myth: Wukong"" ở Trung Quốc hay ""Tai Ương"" ở Việt Nam.
""Cái khó khi thiết kế game về văn hóa là làm sao giữ được tinh thần truyền thống nhưng vẫn mang tính giải trí, kỳ thú, thu hút người chơi"", Khang nói.
Nam sinh tìm hiểu hoa văn, họa tiết, trang phục, tín ngưỡng trên nhiều chất liệu. Sau đó, Khang chọn chủ đề để kết hợp các chất liệu với nhau, cách điệu để tạo ra nét mới nhưng vẫn giữ được màu sắc truyền thống.
""Mamoris"" là thể loại game nhập vai, bối cảnh đại dương bao la với nhiều hòn đảo, mỗi đảo đại diện cho một nền văn minh. Khi nước biển dâng cao, cuộc sống của người dân trên đảo bị thu hẹp. Những quái vật bí ẩn bắt đầu hiện diện, ký sinh vào các vật thể và làm thay đổi chúng. Người chơi có nhiệm vụ tiêu diệt quái vật để bảo vệ hòn đảo, khôi phục những vật phẩm văn hóa về hình dáng ban đầu. Bối cảnh trong game được lấy cảm hứng từ nền văn hóa Đại Việt thời nhà Nguyễn.
Khang nhìn nhận cần giải quyết khối lượng công việc rất lớn, kết hợp nhiều lĩnh vực để một tựa game có thể vận hành. Nam sinh dự định hoàn thiện phần đồ họa, tạo hình nhân vật, bối cảnh và làm video mô phỏng không gian, luật chơi dạng 3D. Nhưng để kịp thời gian bảo vệ đồ án, Khang chỉ có thể làm video mô phỏng 2D.
""Nhiều đêm mình thức trắng để kịp tiến độ nhưng video mô phỏng chỉ dừng lại ở dạng 2D nên nhân vật còn chưa được sinh động, màu sắc còn hơi hoạt hình"", Khang tự đánh giá. ""Đây là điểm khiến mình tiếc nuối"".
Huỳnh Nhật Khang, sinh viên năm cuối ngành Thiết kế đồ họa, trường Đại học Văn Lang. Ảnh:
Nhân vật cung cấp
Là người hướng dẫn đồ án thực tập, thạc sĩ Hoàng Thị Anh Nghi, giảng viên ngành Thiết kế đồ họa, đánh giá kỹ năng thiết kế, tạo hình của Khang hoàn thiện, chuyển tải tốt tinh thần văn hóa. Quá trình thực hiện đồ án, nam sinh chịu khó lắng nghe và chỉnh sửa sau mỗi lần giảng viên góp ý, thay vì đề cao cái tôi cá nhân.
Theo cô, Khang vẽ ""quái vật"" trong game đẹp nhờ chịu khó nghiên cứu, kết hợp các chất liệu từ đời sống. Nhiều bối cảnh, di tích trong game được em xử lý tốt, có tiền, trung, hậu cảnh, lớp lang với nhau.
""Điểm đáng tiếc là kỹ năng vẽ người của em ấy chưa tốt, khiến nhân vật chưa sinh động, có hồn"", cô Nghi nhận xét.
Đánh giá cao ý tưởng và sản phẩm của Khang nhưng cô Nghi cho rằng khó có thể đưa tựa game này ra thị trường. Thị trường Việt Nam chủ yếu là game nước ngoài, hiếm sản phẩm thuần Việt.
Biết vậy nhưng Nhật Khang cho hay vẫn ấp ủ dự án này. Nam sinh dự định tìm công việc thiết kế liên quan mảng game để học hỏi thêm trước khi tìm kiếm nơi phối hợp sản xuất.
Lệ Nguyễn",https://vnexpress.net/thiet-ke-game-giup-nam-sinh-thanh-a-khoa-do-an-tot-nghiep-4862046.html
51,"Thứ sáu, 24/1/2025, 16:00 (GMT+7)",Nam sinh nuôi dưỡng đam mê thiết kế game với khóa lập trình trực tuyến,"Theo học lập trình tại FUNiX, Nguyễn Hải Đăng được trang bị nhiều kiến thức khoa học máy tính và tiếp thêm niềm đam mê với thiết kế game.","Vốn yêu thích sự sáng tạo và yêu thích game, Hải Đăng (học sinh lớp 11 Trường Quốc tế Việt Úc, TP HCM) được truyền cảm hứng bởi Toby Fox - một nhà phát triển trò chơi điện tử và nhà soạn nhạc người Mỹ. Ông đã kết hợp làm game bằng nghệ thuật, vượt trội là phần âm thanh với nhiều bản nhạc cổ điển hay.
Mong muốn có thể sử dụng nghệ thuật vào nhiều lĩnh vực như trò chơi điện tử, mod diễn đàn... Hải Đăng quyết tâm theo học bộ môn lập trình. Cậu học trò lớp 11 được bố mẹ ủng hộ ngay khi chọn khóa Khoa học máy tính với Python tại FUNiX.
""Dù con có học về ngành nào thì cũng cần hiểu biết về CNTT nói riêng và tư duy logic nói chung, nên gia đình muốn con học để nâng cao kỹ năng tư duy về công nghệ"", anh Nguyễn Công Tẩn, phụ huynh của Hải Đăng chia sẻ. Làm việc trong lĩnh vực công nghệ thông tin, người cha sớm nhìn nhận đây là nền tảng của các ngành, lĩnh vực khác. Anh cũng biết đến chương trình đào tạo uy tín của FUNiX qua một người bạn có con đang theo học chương trình chuyển tiếp đại học tại đây.
Anh cho biết thêm, Hải Đăng tự tìm hiểu thêm hai địa chỉ học lập trình khác, nhưng cuối cùng hai bố con đã lựa chọn theo học tại FUNiX, bởi chương trình học theo giáo trình chuẩn quốc tế, cung cấp kiến thức từ cơ bản đến nâng cao. Con được học trực tuyến trên nền tảng Code Comnbat của Mỹ, đồng thời có đội ngũ
mentor
(cố vấn chuyên môn) tâm huyết, luôn sẵn sàng hướng dẫn 1:1 và truyền động lực cho học trò.
Nhập học FUNiX từ mùa hè 2024, với lịch học dày đặc ở trên trường nên mỗi tuần Hải Đăng chỉ dành một đến hai buổi để vào Zoom học lập trình cùng mentor Hoàng Sơn. Ban đầu, Đăng thấy Python khó, nhưng dần cảm thấy thú vị và nhận thấy ngôn ngữ lập trình này có nhiều tiềm năng về sau.
Điều mà Hải Đăng ưng ý nhất khi học tại FUNiX chính là sự đồng hành của mentor. Không chỉ được mentor Sơn hướng dẫn kiến thức tại FUNiX, em còn được mentor lắng nghe chia sẻ việc học trên trường, điều chỉnh cách dạy cho phù hợp với lượng thời gian em có. Mỗi buổi học luôn là mỗi giờ mà cậu học sinh lớp 11 trường Trường Quốc tế Việt Úc được sống với chính đam mê của mình.
Nguyễn Hải Đăng, lớp 11 Trường Quốc tế Việt Úc, TP HCM được trang bị nhiều kiến thức khoa học máy tính tại FUNiX. Ảnh:
Nhân vật cung cấp
""Mentor Sơn rất tuyệt, từng khoảnh khắc học tập với em đều đáng nhớ"", Đăng nói, cho biết thêm mentor như một người bạn khiến cho lập trình trở nên gần gũi và khi học em thấy không hề thấy khó nữa.
Sự đồng hành sát sao của mentor đã giúp Đăng thêm tự tin chinh phục ba học phần của khóa học Khoa học máy tính với Python một cách nhanh chóng. Đăng tiếp thu được nhiều kiến thức nền tảng logic của khoa học máy tính, biết được quá trình để tạo ra một trò chơi hay một trang web. Trong đó, nam sinh thích thú khi được trải nghiệm cách làm mode game với việc tự mình tạo ra cốt truyện, màn chơi, có thể thay đổi các kiểu chơi theo ý muốn.
Sau khi hoàn thành khóa học, Hải Đăng cho biết muốn tiếp tục chinh phục các khóa lập trình khác ở FUNiX, để trau dồi thêm nhiều kiến thức mới và nâng cao hơn. Cậu chia sẻ ước mơ trong tương lai là làm thiết kế game và điện ảnh, đồng thời cũng có sở thích riêng về làm nhạc. Dù theo đuổi công việc gì, Đăng luôn muốn sống trọn với những sở thích và đam mê của mình.
Đồng hành cùng Hải Đăng trong khóa học, mentor Hoàng Sơn khen ngợi em có tố chất học lập trình, tư duy logic nhạy bén, trí tưởng tượng phong phú và có nhiều ý tưởng sáng tạo. Đăng luôn biết giải quyết vấn đề theo cách độc đáo, nếu tiếp tục được phát triển thì em sẽ chinh phục mục tiêu mà em mong muốn.
Anh Công Tẩn, phụ huynh của Hải Đăng cũng hài lòng khi thấy con yêu thích việc học lập trình. Con luôn tự giác, chủ động học. Anh cũng đánh giá cao sự sát sao của mentor, thầy luôn gửi thông báo và nhận xét sau mỗi buổi học qua zalo.
Thấu hiểu tâm lý lứa tuổi, bố mẹ Đăng luôn muốn định hướng nghề nghiệp tương lai dựa trên năng lực, sở thích và đam mê của con. ""Hải Đăng có tư duy nhanh nhạy với các môn tự nhiên, nhưng con vẫn muốn theo ngành thiết kế. Gia đình luôn ủng hộ ngay cả khi con muốn tiếp tục học nâng cao hơn ở FUNiX, để theo đuổi sở thích với công nghệ thông tin, giúp con có định hướng rõ ràng hơn cho công việc tương lai"", anh Tẩn nói thêm.
Vân Anh
Khoa học máy tính với
Python
tại FUNiX là chương trình đào tạo công nghệ dành cho học sinh, độ tuổi phù hợp là 11 tuổi trở lên. Khóa học sử dụng học liệu từ Code Combat, cung cấp kiến thức công nghệ, giúp các em ứng dụng công nghệ thông tin vào cuộc sống và học tập. Khi học tại FUNiX, học sinh được học cùng mentor theo lớp 1:1 hoặc học nhóm tùy đặc điểm từng em.
Phụ huynh quan tâm, đăng ký cho con học thử miễn phí lập trình
tại đây
.",https://vnexpress.net/nam-sinh-nuoi-duong-dam-me-thiet-ke-game-voi-khoa-lap-trinh-truc-tuyen-4842959.html
52,"Thứ hai, 15/7/2024, 16:11 (GMT+7)","Việc làm, tiền lương ngành Thiết kế game","Học ngành Game, sinh viên ra trường có thể nhận lương khởi điểm 10-20 triệu đồng mỗi tháng, theo Học viện Công nghệ Bưu chính Viễn thông.","Theo công ty nghiên cứu thị trường trò chơi điện tử (game)
Newzoo
, thế giới hiện có khoảng 3 tỷ người chơi game, dự kiến lên thành 4,5 tỷ người vào năm 2030. Thị trường được dự đoán đạt doanh thu 218,7 tỷ USD trong năm nay.
Tại Việt Nam, Bộ Thông tin và Truyền thông đặt mục tiêu trong 5 năm tới có khoảng 100-150 doanh nghiệp phát hành game, quy mô thị trường đạt một tỷ USD, đồng thời có thêm khoảng 400 dự án khởi nghiệp.
Một số chuyên gia trong ngành cho hay nếu đạt được quy mô này, nhu cầu nhân sự sẽ lên tới 25.000 người, gồm công việc toàn thời gian, bán thời gian và freelancer (làm tự do).
TS Cao Minh Thắng, Phó viện trưởng Viện công nghệ Thông tin và Truyền thông, Học viện Công nghệ Bưu chính Viễn thông (PTIT), cho hay theo khảo sát, hiện có khoảng 800 bài đăng tuyển nhân sự game trên các trang tuyển dụng, từ 45 doanh nghiệp trong nước. Trong đó, 50% vị trí tuyển chuyên gia phát triển, 30% về thiết kế. Các doanh nghiệp được trường thăm dò cũng gửi về kết quả khá tương đồng.
Đây là lý do hai năm qua, PTIT nghiên cứu chương trình Thiết kế và Phát triển game, thuộc ngành Công nghệ đa phương tiện, với sự hỗ trợ của các cơ quan ban ngành và doanh nghiệp. Chương trình bắt đầu tuyển với 200 sinh viên vào năm học này.
Trước đó, hai đại học quốc tế là RMIT và Anh quốc Việt Nam (BUV) đã có chương trình về Thiết kế game. Vì vậy, PTIT được coi là đại học Việt Nam đầu tiên đào tạo ngành này.
Chương trình học
Chương trình của PTIT được xây dựng dựa trên khảo sát yêu cầu tuyển dụng của doanh nghiệp, tham khảo chương trình của nhiều đại học có ngành game trên thế giới như Đại học New York, Southern California hay Viện Công nghệ Digipen của Mỹ.
Sinh viên được học các kiến thức cơ bản về lý luận chính trị, hệ thống pháp luật Việt Nam, kiến thức đại cương về khoa học tự nhiên, khoa học xã hội như các ngành khác.
Vào chuyên ngành, các em sẽ tìm hiểu tổng quan về ngành công nghiệp game, các nguyên lý thiết kế cũng kiến thức liên ngành về tâm lý, kinh tế, pháp luật, marketing. Ngoài ra, sinh viên được tiếp cận những kiến thức, kỹ năng chuyên môn để xây dựng kịch bản game, có khả năng giữ chân người chơi và tạo doanh thu, cung cấp dịch vụ trên các nền tảng.
Người học cũng được trang bị kiến thức, kỹ năng về khoa học máy tính và công nghệ đa phương tiện, an toàn thông tin. Đây là những kiến thức nền tảng để phát triển các game hoàn chỉnh theo kịch bản cũng như kiểm thử, đánh giá, triển khai, cung ứng và bảo vệ dịch vụ game một cách an toàn, hợp pháp.
Chương trình học gồm cả các dự án thực tế tại doanh nghiệp từ năm thứ hai, cũng như cơ hội tham quan học tập, làm việc tại những quốc gia có nền công nghiệp game phát triển như Nhật Bản, Hàn Quốc.
TS Cao Minh Thắng chia sẻ tại Diễn đàn Game Việt Nam 2024. Ảnh:
Quỳnh Trần
Thời gian đào tạo và học phí
Chương trình đào tạo Thiết kế và Phát triển game thuộc ngành Công nghệ Đa phương tiện, kéo dài 8 học kỳ với 135 tín chỉ.
Học phí năm học 2024-2025 của Học viện Công nghệ Bưu chính Viễn thông khoảng 27-34 triệu đồng với các chương trình đại trà, bao gồm Thiết kế và Phát triển game.
Cơ hội nghề nghiệp
Vị trí công việc chính của sinh viên sau khi ra trường theo định hướng là chuyên gia thiết kế kịch bản game (Game designer) hay chuyên gia phát triển (Game developer) tại các công ty, studio thiết kế, phát triển và phân phối game trong và ngoài nước như VTC Game, VNG, Game Loft,...
Tuy nhiên, sinh viên vẫn có đầy đủ kiến thức, kỹ năng để đảm nhận các vị trí:
- Chuyên viên kiểm thử game (Game Tester).
- Chuyên viên triển khai, vận hành, bảo trì các hệ thống game (Game Tecnical Operator).
- Chuyên viên thiết kế, phát triển, kiểm thử phần mềm (Software Developer, Software Tester).
- Chuyên viên quản lý nhà nước về Phát thanh truyền hình và Thông tin điện tử, Công nghệ thông tin tại các bộ, ngành, địa phương.
Ngoài ra, sinh viên cũng có thể khởi nghiệp, trở thành cán bộ nghiên cứu, giảng viên về thiết kế và phát triển game tại các viện, trung tâm và các cơ sở đào tạo.
Thu nhập
Học viện Công nghệ Bưu chính đã khảo sát thị trường lao động, thu nhập của sinh viên ngành Công nghệ Đa phương tiện hiện làm trong ngành game.
Kết quả cho thấy mức lương của sinh viên sau khi ra trường 1-2 năm (Junior) khoảng 10-20 triệu đồng một tháng. Nhiều người nhận mức gấp 2-3 lần sau vài năm.
Với những ứng viên có khả năng sáng tạo và khởi nghiệp, thu nhập có thể lớn hơn rất nhiều.
Dương Tâm",https://vnexpress.net/viec-lam-tien-luong-nganh-thiet-ke-game-4746000.html
53,"Thứ hai, 27/5/2024, 09:00 (GMT+7)",Tiềm năng ngành thiết kế game cho giới trẻ,"Các chuyên gia trong lĩnh vực sẽ bàn thảo về tiềm năng ngành thiết kế game Việt Nam trong tương lai, tại tọa đàm Game Talks công chiếu ngày 28/5 trên VnExpress.","Tọa đàm Game Talks với chủ đề ""Thiết kế Game – Cuộc chơi tiềm năng cho người trẻ"" công chiếu trên
VnExpress
lúc 9h ngày 28/5. Chương trình có sự tham gia của ông Nguyễn Phú Hồng Phúc, Giám đốc bộ phận Game Design của Gameloft Việt Nam; ông Dzuy Anh Đỗ, Phó giảng viên ngành Cử nhân Thiết kế Game, đại học RMIT Việt Nam. Người dẫn dắt chương trình là bà Trần Thị Mỹ Linh, Game Producer tại Gameloft, Sài Gòn Studio.
MC (bên trái) và hai diễn giả tại tọa đàm Game Talks 2024. Ảnh:
Trần Quỳnh
Tại tọa đàm, hai diễn giả và MC sẽ cập nhật các thông tin về nguồn nhân lực, cơ hội việc làm cho giới trẻ trong ngành game, đặc biệt ở lĩnh vực Game Design (thiết kế game). Đây là lĩnh vực đã có những góc nhìn cởi mở hơn tại Việt Nam, nhiều trường đại học, cơ sở đào tạo đã cung cấp những ngành và khóa học phù hợp, nhưng giới trẻ vẫn có sự dè dặt nhất định, chưa được cung cấp thông tin và định hướng đầy đủ.
Ông Dzuy Anh Đỗ, Phó giảng viên ngành Cử nhân Thiết kế Game, đại học RMIT Việt Nam. Ảnh:
Trần Quỳnh
Với góc nhìn từ nhà đào tạo, ông Dzuy Anh Đỗ sẽ cung cấp những khái niệm cơ bản về Game Design, những kỹ năng được đào tạo, cùng tố chất cần thiết dành cho nhân sự của ngành này. Ở phía nhà tuyển dụng, ông Nguyễn Phú Hồng Phúc, Giám đốc bộ phận Game Design của Gameloft Việt Nam sẽ đưa ra quan điểm về nhu cầu nguồn nhân lực trong ngành, cũng như đánh giá chung về thế mạnh, cơ hội phát triển lĩnh vực này tại Việt Nam.
Cuối tọa đàm, MC và 2 diễn giả sẽ tổng kết lại những thông tin nhằm giúp các bạn trẻ hiểu rõ hơn về định hướng của ngành, cũng như độ tuổi phù hợp để bắt đầu trở thành một Game Designer.
Ông Nguyễn Phú Hồng Phúc, Giám đốc bộ phận Game Design của Gameloft Việt Nam. Ảnh:
Trần Quỳnh
Game Talks là một trong những hoạt động thuộc khuôn khổ Triển lãm Vietnam GameVerse 2024, do Cục Phát thanh, Truyền hình và Thông tin điện tử - Bộ Thông tin và Truyền thông, báo
VnExpress
phối hợp cùng Liên minh Game Việt Nam và Công ty Cổ phần Dịch vụ trực tuyến FPT tổ chức.
Tuấn Vũ",https://vnexpress.net/tiem-nang-nganh-thiet-ke-game-cho-gioi-tre-4750821.html
54,"Thứ ba, 28/5/2024, 09:00 (GMT+7)",'Nhiều cơ hội cho người trẻ theo đuổi thiết kế game',"Giám đốc Game Design Gameloft Việt Nam và Phó giảng viên Cử nhân thiết kế Game đại học RMIT Việt Nam chia sẻ góc nhìn, cơ hội cho người trẻ tại toạ đàm Game Talks.","Cơ hội của người trẻ trong ngành thiết kế Game
Quang Anh
Khách mời của Tọa đàm Game Talks ""Thiết kế Game – Cuộc chơi tiềm năng cho người trẻ"":
- Ông Nguyễn Phú Hồng Phúc, Giám đốc bộ phận Game Design của Gameloft Việt Nam.
- Ông Dzuy Anh Đỗ, Phó giảng viên ngành Cử nhân Thiết kế Game, Đại học RMIT Việt Nam.
- Host: Bà Trần Thị Mỹ Linh, Game Producer tại Gameloft, Sài Gòn Studio.
Game Talks là một trong những hoạt động thuộc khuôn khổ Triển lãm Vietnam GameVerse 2024, do Cục Phát thanh, Truyền hình và Thông tin điện tử - Bộ Thông tin và Truyền thông, báo
VnExpress
phối hợp cùng Liên minh Game Việt Nam và Công ty Cổ phần Dịch vụ trực tuyến FPT tổ chức.",https://vnexpress.net/nhieu-co-hoi-cho-nguoi-tre-theo-duoi-thiet-ke-game-4751109.html
